Attribute,unique artifact,Specific Location,state,Identifier1,Identifier2,Identifier3,Identifier4,Old Identifier,Influence Locations,Image Link1,Image Link2,,,"{Identifier} famous throughout India, originated in {specific location}",,,,,,,,,,,Attribute,state,
History,Naina devi Temple,Nainital,Uttarakhand,A temple located on the northern bank of the Naini Lake,This temple was destroyed by a landslide in 1880.,There are two eyes in the temple which represent Naina Devi.,,A temple located on the northern bank of the Naini Lake,,"https://hi.wikipedia.org/wiki/%E0%A4%A8%E0%A5%88%E0%A4%A8%E0%A4%BE_%E0%A4%A6%E0%A5%87%E0%A4%B5%E0%A5%80_%E0%A4%AE%E0%A4%82%E0%A4%A6%E0%A4%BF%E0%A4%B0,_%E0%A4%A8%E0%A5%88%E0%A4%A8%E0%A5%80%E0%A4%A4%E0%A4%BE%E0%A4%B2",https://en.wikipedia.org/wiki/Kavigan,,,"A temple located on the northern bank of the Naini Lake famous throughout India, originated in Nainital, Uttarakhand",,,,,,,,,,,History,Uttarakhand,"The state in which the famous hill station Nainital is located is also home to a temple on the northern bank of Naini Lake, considered a significant cultural artifact. What is the name of this temple?"
Festival,Purnagiri Mela,Champawat,Uttarakhand,The religious festival held at the Purnagiri temple,The religious festival is held here every year to honor Goddess Sati,The fair is held during Chaitra Navratre.,,The religious festival held at the Purnagiri temple,,https://utsav.gov.in/view-event/purnagiri-mela-1,,,,"The religious festival held at the Purnagiri temple  famous throughout India, originated in Champawat",,,,,,,,,,,Festival,Andhra_Pradesh,
History,Alaknanda River,Devprayag,Uttarakhand,A sacred Himalayan river and one of the two headstreams of the Ganges ,It is considered holy in Hinduism,It originates at the confluence of the Satopanth and Bhagirath Kharak glaciers,,A sacred Himalayan river and one of the two headstreams of the Ganges which is considered holy in Hinduism originates at the confluence of the Satopanth and Bhagirath Kharak glaciers,,https://en.wikipedia.org/wiki/Alaknanda_River,,,,,,,,,,,,,,,Tourism,Arunachal_Pradesh,
Tourism,Chota Char Dham,Garhwal region,Uttarakhand,"A Hindu pilgrimage circuit consists of four sacred sites Yamunotri, Gangotri, Kedarnath, and Badrinath ","considered holy due to their associations with the Ganges and Yamuna rivers, Lord Shiva, and Lord Vishnu",,,"A Hindu pilgrimage circuit consists of four sacred sites Yamunotri, Gangotri, Kedarnath, and Badrinath considered holy due to their associations with the Ganges and Yamuna rivers, Lord Shiva, and Lord Vishnu",,https://uttarakhandtourism.gov.in/experiences/char-dham,,,,,,,,,,,,,,,Personalities,Chhattisgarh,
History,Tungnath,Rudraprayag_district,Uttarakhand,One the highest Shiva temples in the world,"located at an altitude of 3,680 m (12,073 ft)",just below the peak of Chandrashila,,"One the highest Shiva temples in the world located at an altitude of 3,680 m (12,073 ft), and just below the peak of Chandrashila",,https://en.wikipedia.org/wiki/Tungnath,,,,,,,,,,,,,,,Costume,West_Bengal,
History,Kedarnath town,Rudraprayag district,Uttarakhand,"A small, high-altitude Himalayan town known for its iconic Kedarnath Temple"," It is a revered pilgrimage site for Hindus located at 3,584 meters (11,755 ft) near the Chorabari Glacier","Source of the Mandakini River, and is surrounded by snow-capped mountains",,"A small, high-altitude Himalayan town known for its iconic Kedarnath Temple, a revered pilgrimage site for Hindus located at 3,584 meters (11,755 ft) near the Chorabari Glacier, source of the Mandakini River, and is surrounded by snow-capped mountains",,https://badrinath-kedarnath.gov.in/AboutUs/shri-kedarnath.aspx,,,,,,,,,,"A small, high-altitude Himalayan town known for its iconic Kedarnath Temple, a revered pilgrimage site for Hindus located at 3,584 meters (11,755 ft) near the Chorabari Glacier, source of the Mandakini River, and is surrounded by snow-capped mountains, originated in Rudraprayag_district of a state widely known for Gangotri.",,,,,Language,Andaman_and_Nicobar,
History,Nanda Devi,Chamoli district,Uttarakhand,The 23rd-highest peak in the world and ranked 74th by prominence ,the highest mountain in the world before computations in 1808,,,The 23rd-highest peak in the world and ranked 74th by prominence and the highest mountain in the world before computations in 1808,,https://en.wikipedia.org/wiki/Nanda_Devi,,,,,,,,,,a state widely known for Sage Vashistha's enlightenment cave,,,,,Religion,Jammu_kashmir,
Festival,Ganga Dussehra,Haridwar,Uttarakhand,A  Hindu festival celebrating the avatarana  of the Ganges ,Was believed by Hindus that the holy river Ganges descended from heaven to earth on this day,,,A  Hindu festival celebrating the avatarana  of the Ganges believed by Hindus that the holy river Ganges descended from heaven to earth on this day,,https://en.wikipedia.org/wiki/Ganga_Dussehra,,,,,,,,,,,,,,,Dance_and_Music,Himachal_Pradesh,
History,Bhagirathi,Devprayag,Uttarakhand,"A name for the river Ganga, specifically the  river that emerges from the Gangotri Glacier ",personified by King Bhagiratha's efforts to bring the river to earth,,,"A name for the river Ganga, specifically referring to its source stream, the river that emerges from the Gangotri Glacier considered the divine origin of the Ganga in Hindu mythology, personified by King Bhagiratha's efforts to bring the river to earth",,https://en.wikipedia.org/wiki/Bhagirathi_River,,,,,,,,,,,,,,,Cuisine,Sikkim,
History,Gangotri,Uttarkashi district,Uttarakhand,A Hindu pilgrim town on the banks of the river Bhagirathi ,"located on the Greater Himalayan Range, at a height of 3,100 metres (10,200 ft)",,,"A Hindu pilgrim town on the banks of the river Bhagirathi located on the Greater Himalayan Range, at a height of 3,100 metres (10,200 ft)",,https://uttarakhandtourism.gov.in/destination/gangotri,,,,,,,,,,,,,,,Sports,Punjab,
Tourism,Haridwar,Haridwar district,Uttarakhand,A  city  situated on the right bank of the Ganges river at the foothills of the Shivalik ranges  ,"It is considered the ""gateway to gods"" ",a sacred place where pilgrims seek purification by taking holy dips in the Ganges river,,"A  city  situated on the right bank of the Ganges river at the foothills of the Shivalik ranges  considered the ""gateway to gods"" and a sacred place where pilgrims seek purification by taking holy dips in the river",,https://en.wikipedia.org/wiki/Haridwar,,,,,,,,,,,,,,,Art,Chandigarh,
Personalities,Sage Vashistha enlightenment cave,Shivpuri Range,Uttarakhand,One of the oldest and revered Vedic rishis or sages ,one of the Saptarishis credited as the chief author of Mandala 7 of the Rigveda,,,One of the oldest and revered Vedic rishis or sages and one of the Saptarishis credited as the chief author of Mandala 7 of the Rigveda,,https://en.wikipedia.org/wiki/Vasishtha,,,,,,,,,,,,,,,Rituals_and_Ceremonies,Manipur,
Tourism,the Hemkund Sahib Gurdwara,Chamoli district,Uttarakhand,"A  Sikh place of worship and pilgrimage site  devoted to Guru Gobind Singh located  at an elevation of 4,572 metres (15,000 feet)","pilgrimage site in Chamoli district, Uttarakhand, India.",finds mention in Dasam Granth. ,,"A  Sikh place of worship and pilgrimage site  devoted to Guru Gobind Singh located  at an elevation of 4,572 metres (15,000 feet)",,https://en.wikipedia.org/wiki/Gurdwara_Hemkund_Sahib,,,,,,,,,,,,,,,Cultural_Common_Sense,Meghalaya,
Tourism,Har ki Pauri,Haridwar,Uttarakhand,A sacred and most important religious place located on the banks of the Ganges river believed that bathing here leads to salvation,It means the feet of Lord Vishnu (Hari).,It is believed to be the exact spot where the Ganges leaves the mountains and enters the plains,,A sacred and most important religious place located on the banks of the Ganges river believed that bathing here leads to salvation,,https://hi.wikipedia.org/wiki/%E0%A4%B9%E0%A4%B0_%E0%A4%95%E0%A5%80_%E0%A4%AA%E0%A5%8C%E0%A4%A1%E0%A4%BC%E0%A5%80,,,,,,,,,,,,,,,Transport,Mizoram,
Tourism,Bholanath,Kumaon,Uttarakhand,An epithet of the Hindu god Shiva as the lord of innocence,"Chand King, Udai Chand, disinherited his elder son  ,gave the Kingdom to his younger son and later the elder son,his wife ,their new born child became ghost and was worshiped from then",,,An epithet of the Hindu god Shiva as the lord of innocence,,https://en.wikipedia.org/wiki/Hindu_deities,https://uttarakhandtourism.gov.in/tourism-circuit-details/folk-gods-of-uttarakhand,,,,,,,,,,,,,,Medicine,Nagaland,
History,Surkanda Devi temple architecture,Dhanaulti in the Tehri Garhwal district,Uttarakhand,"A Hindu shrine  Situated at an altitude of approximately 2,756 metres (9,042 feet)  and one of the revered Shakti pitha sites","located near Dhanaulti in the Tehri Garhwal district of Uttarakhand, India. ","It is one of the revered Shakta pitha sites, associated with the mythological event where the head (Sir) of the goddess Sati is believed to have fallen, ",,"A Hindu shrine  Situated at an altitude of approximately 2,756 metres (9,042 feet)  and one of the revered Shakti pitha sites",,https://www.timesnownews.com/spiritual/religion/article/himalayan-temples-and-shrines-that-every-devotee-wants-to-trek-to-at-least-once-in-a-lifetime/701130,https://en.wikipedia.org/wiki/Surkanda_Devi,,,,,,,,,,,,,,0,Telangana,
Costume,Ghagara,Jaunsar-Bawar,Uttarakhand,A type of ethnic clothing for women often paired with a fitted blouse and a dupatta to complete a lehenga outfit,"is usually a 6 to 7 meters long piece of cloth, stitched together to form a long skirt","it's unique due to its sharp folds/pleats known as Luria,such a texture is achieved by heat-pleating the folds.",,A type of ethnic clothing for women often paired with a fitted blouse and a dupatta to complete a lehenga outfit," Rajasthan,Gujarat,Madhya Pradesh, Uttar Pradesh, Bihar, Haryana, Punjab, Himachal Pradesh, Jammu and Kashmir",https://en.wikipedia.org/wiki/Ghagra_choli,https://en.wikipedia.org/wiki/Jaunsari_people,,,,,,,,,,,,,,,Tripura,
Language,Kumaoni,Kumaon,Uttarakhand,"An Indo-Aryan language spoken by over two million people, as their first-language, by the people who have their origin in Kumaon",is written using the Devanagari script.,"UNESCO's Atlas of the World's Languages in Danger designates it as a language in the unsafe category, meaning it requires consistent conservation efforts.",,"An Indo-Aryan language spoken by over two million people, as their first-language, by the people who have their origin in Kumaon",,https://en.wikipedia.org/wiki/Kumaoni_people,,,,,,,,,,,,,,,,Bihar,
Religion,Shaivism,Kedarkhand (now Garhwal) and Manaskhand (Kumaon),Uttarakhand,One of the major Hindu traditions that worships Shiva ,"which is developed as an amalgam of pre-Aryan religions and traditions, Vedic Rudra, and post-Vedic traditions","Also  accommodating local traditions and Yoga, puja and bhakti",,"One of the major Hindu traditions that worships Shiva developed as an amalgam of pre-Aryan religions and traditions, Vedic Rudra, and post-Vedic traditions, accommodating local traditions and Yoga, puja and bhakti",,https://en.wikipedia.org/wiki/Shaivism,https://www.ijfmr.com/papers/2023/5/6506.pdf,,,,,,,,,,,,,,,Odisha,
Festival,Nanda Devi Raj Jaat,Chamoli district,Uttarakhand,A three-week-long pilgrimage and festival celebrated in Kurur Village Of Nandanagar,organised once every 12 years in Chamoli District of Garhwal region of Uttarakhand state in India,"involving a challenging trek covering around 280–290 km, with daily halts at various villages and high-altitude sites, culminating in religious ceremonies at Homkund",,A three-week-long pilgrimage and festival celebrated in Kurur Village Of Nandanagar,,https://en.wikipedia.org/wiki/Nanda_Devi_Raj_Jat,,,,,,,,,,"A three-week-long pilgrimage and festival celebrated in Kurur Village Of Nandanagar, associated with Chamoli district of a state widely known for Bholanath.  According to you which one of the following this statement points to",,,,,,Rajasthan,
Dance_and_Music,Algoza,Kutch,Uttarakhand,A traditional musical wind instrument, typically made of two joined beak flutes,"one flute plays the melody, while the other provides a drone",,"A traditional musical wind instrument, typically made of two joined beak flutes, one flute plays the melody, while the other provides a drone",,https://en.wikipedia.org/wiki/Alghoza,https://en.wikipedia.org/wiki/Alghoza,,,,,,,,,,,,,,,Gujarat,
Festival,Ramman festival,Garhwal,Uttarakhand,A religious festival and ritual theatre celebrated annually in the twin villages of Saloor-Dungra ,honors the local deity Bhumiyal Devta," involves theatrical performances, music, and traditional oral and written tales",,"A religious festival and ritual theatre celebrated annually in the twin villages of Saloor-Dungra honors the local deity Bhumiyal Devta and involves theatrical performances, music, and traditional oral and written tales",,https://en.wikipedia.org/wiki/Ramman_(festival),,,,,,,,,,,,,,,,Madhya_Pradesh,
History,Ganges,Devprayag,Uttarakhand,"A 2,525-kilometre-long (1,569 mi) trans-boundary river",considered as one of the holiest flowing through the Himalayas,,,"A 2,525-kilometre-long (1,569 mi) trans-boundary river also considered as one of the holiest flowing through the Himalayas",,https://en.wikipedia.org/wiki/Ganges,,,,,,,,,,,,,,,,Maharashtra,
History,Kumaon,Manaskhand,Uttarakhand,An Indo-Aryan ethnolinguistic group and is believed to be the birth place of Kurma avatar of Hindu god Vishnu, the region has been ruled by several dynasties over the course of history; most notably the Katyuris and the Chands,,,An Indo-Aryan ethnolinguistic group and is believed to be the birth place of Kurma avatar of Hindu god Vishnu,,https://en.wikipedia.org/wiki/Kumaoni_people,,,,,,,,,,,,,,,,Goa,
Festival,Uttarayani festival,Kumaon,Uttarakhand,"An annual fair that marks the occasion of Makar Sankranti, typically taking place in the second week of January","It marks the occasion of Makar Sankranti, typically taking place in the second week of January",This astronomical event marks the end of the winter solstice and the beginning of longer days.,,"An annual fair that marks the occasion of Makar Sankranti, typically taking place in the second week of January",,https://en.wikipedia.org/wiki/Uttarayani_Fair,,,,,,,,,,,,,,,,Uttar_Pradesh,
Language,Kumaoni dialects,Kumaon,Uttarakhand,An Indo-Aryan language spoken by over two million people,UNESCO's Atlas of the World's Languages in Danger designates it as a language in the unsafe category,,,An Indo-Aryan language spoken by over two million people,,https://en.wikipedia.org/wiki/Kumaoni_people,,,,,,,,,,,,,,,,Karnataka,
Dance_and_Music,Choliya dance,Kumaon,Uttarakhand,A traditional folk dance which is a symbol of Kumaoni and Sudurpashchimi cultures performed on many auspicious occasions,"It has today become a symbol of Kumaoni and Sudurpashchimi (mainly in Doti, Baitadi and Darchula districts) cultures.",It is basically a sword dance accompanying a marriage procession but now it is performed on many auspicious occasions.,,A traditional folk dance which is a symbol of Kumaoni and Sudurpashchimi cultures performed on many auspicious occasions,,https://en.wikipedia.org/wiki/Chholiya,,,,,,,,,,,,,,,,Jharkhand,
Dance_and_Music,Ransingha,Almora district,Uttarakhand,A  type of primitive trumpet made of copper or copper alloys ,It is part of a group of curved-tube instruments,"The instrument is made of two metal curves, joined to form an ""S"" shape.",,A  type of primitive trumpet made of copper or copper alloys ,,https://en.wikipedia.org/wiki/Ransingha,,,,,,,,,,,,,,,,Kerala,
Cuisine,Bal Mithai,Kumaon,Uttarakhand,"A brown chocolate-like fudge, made with roasted khoya and coated with white balls made of sugar coated roasted poppy seeds",must have been the name of the prime offering to the Sun God,,,"A brown chocolate-like fudge, made with roasted khoya and coated with white balls made of sugar coated roasted poppy seeds",,https://en.wikipedia.org/wiki/Bal_mithai,,,,,,,,,,,,,,,,Lakshadweep,
Cuisine,Kafuli,Kumaon,Uttarakhand,A delicacy prepared out of leafy greens such as palak and methi leaves,We also call this cuisine ‘Palak Ka Kapa,,,A delicacy prepared out of leafy greens such as palak and methi leaves,,https://indianculture.gov.in/food-and-culture/timeless-recipes/kafuli,https://www.uttarakhandi.com/kafuli-palak-ka-kapa/,,,,,,,,,,,,,,,Tamil_Nadu,
Tourism,Lakhudiyar Caves,Barechhina village at the banks of the Suyal River in the Almora district,Uttarakhand,A  Caves at the banks of the Suyal River ,"walls of the caves are paintings depicting animals, humans and also tectiforms, created with fingers in black, red and white",,,"A  Caves at the banks of the Suyal River and the walls of the caves are paintings depicting animals, humans and also tectiforms, created with fingers in black, red and white",,https://en.wikipedia.org/wiki/Lakhudiyar_Caves,,,,,,,,,,,,,,,,Ladakh,
Tourism,Nagarjunsagar-Srisailam Tiger Reserve,"Nandyal,Prakasakam,Palnadu,Nalgonda,Mahabub Nagar districts",Andhra_Pradesh,The largest tiger reserve located in the Nallamala hills  ,"encompassing an area of 3,728 km2 (1,439 sq mi) and its core area is 1,200 km2 (460 sq mi)",,,"The largest tiger reserve located in the Nallamala hills  encompassing an area of 3,728 km2 (1,439 sq mi) and its core area is 1,200 km2 (460 sq mi)",,https://en.wikipedia.org/wiki/Nagarjunsagar-Srisailam_Tiger_Reserve,,,,,,,,,,,,,,,,Delhi,
Sports,Etikoppaka toys,Anakapalli district,Andhra_Pradesh,A traditionally crafted wooden toys from the village of Etikoppaka ," renowned for their vibrant colors, smooth contours, and use of natural dyes and lacquer",,,"A traditionally crafted wooden toys from the village of Etikoppaka renowned for their vibrant colors, smooth contours, and use of natural dyes and lacquer",,https://en.wikipedia.org/wiki/List_of_wooden_toys,,,,,,,,,,,,,,,,Dadra_and_Nagar_Haveli_and_Daman_and_Diu,
Dance_and_Music,Bobbili Veena,Bobbili of Vizianagaram district,Andhra_Pradesh,A large plucked string instrument used in Carnatic classical music ,"the Veena is named after Bobbili, a place where it was invented",,,"A large plucked string instrument used in Carnatic classical music and the Veena is named after Bobbili, a place where it was invented",,https://en.wikipedia.org/wiki/Bobbili_veena,,,,,,,,,,,,,,,,Assam,
Art,Durgi stone craft,village of Durgi in the Palnadu District,Andhra_Pradesh,A stone carvings made from a special kind of lime stone ,"known for its intricate stone carvings, particularly from soft limestone called ""Suddha Rai""",,,"A stone carvings made from a special kind of lime stone known for its intricate stone carvings, particularly from soft limestone called ""Suddha Rai""",,https://www.incredibleindia.gov.in/en/andhra-pradesh/durgi-stone-carvings,https://palnadu.ap.gov.in/odop/,,https://asiainch.org/craft/stone-carving-of-andhra-pradesh/,,,,,,,,,,,,,Haryana,
Art,Pedana kalamkari,Machilipatnam,Andhra_Pradesh,"A traditional Indian textile art form, particularly known for its block-printing technique using natural dyes originated in Pedana",also known as Machilipatnam style of Kalamkari work which involves vegetable dyed block-painting of a fabric.,,,"A traditional Indian textile art form, particularly known for its block-printing technique using natural dyes originated in Pedana",,https://en.wikipedia.org/wiki/Pedana_kalamkari,,,,,,,,,,,,,,,,Puducherry,
History,Undavalli cave architecture,Guntur district,Andhra_Pradesh,A monolithic Indian rock-cut architecture located south west of Vijayawada ,is one of the centrally protected Monuments of National Importance,,,A monolithic Indian rock-cut architecture located south west of Vijayawada and is one of the centrally protected Monuments of National Importance,,https://en.wikipedia.org/wiki/Undavalli_Caves,,,,,,,,,,,,,,,,0,
Art,Narayanpet handloom,Narayanpet,Andhra_Pradesh,A historic legacy behind the handloom industry known for their cotton and silk varieties ,are characterized by a unique checked surface design with embroidery,,,A historic legacy behind the handloom industry known for their cotton and silk varieties and are characterized by a unique checked surface design with embroidery,,https://telanganatourism.gov.in/partials/about/arts-crafts/narayanpet-handlooms.html,https://narayanpet.telangana.gov.in/handicraft/,,,,,,,,,,,,,,,"Gujrat, Rajasthan, Madhya_Pradesh, West_Bengal and Tripura",
Costume,Dharmavaram silk sarees,Dharmavaram of Anantapur district,Andhra_Pradesh,A prized handloom product woven by hand with mulberry silk and zari often inspired by temple murals and paintings,"The saris are worn in winter or cold conditions, for functions, and are mostly used by dancers of Bharatanatyam and Kuchipudi",,,A prized handloom product woven by hand with mulberry silk and zari often inspired by temple murals and paintings,,https://www.utsavpedia.com/textiles/silk-crusted-with-elegance-and-splendor-dharmavaram-silk/,https://en.wikipedia.org/wiki/Dharmavaram_handloom_pattu_sarees_and_paavadas,,,,,,,,,,,,,,,"Tibet, India",
Art,Amaravati school of sculpture,Amaravati,Andhra_Pradesh,An ancient Indian art style from 2nd century BCE to the end of the 3rd century CE ,also called the Andhra School or Vengi School,,,An ancient Indian art style from 2nd century BCE to the end of the 3rd century CE also called the Andhra School or Vengi School,,https://en.wikipedia.org/wiki/Amaravati_art,,,,,,,,,,,,,,,,,
Art,Kumbhakonam terracotta pottery,Kumbhakonam,Andhra_Pradesh,A clay-based non-vitreous ceramic fired at relatively low temperatures,is a term often used for red-coloured earthenware sculptures,,,A clay-based non-vitreous ceramic fired at relatively low temperatures,,https://en.wikipedia.org/wiki/Terracotta,,,,,,,,,,,,,,,,,
History,Undavalli Caves,Guntur district,Andhra_Pradesh,The monolithic Indian rock-cut architecture,located south west of Vijayawada and is one of the centrally protected Monuments of National Importance,,,The monolithic Indian rock-cut architecture located south west of Vijayawada and is one of the centrally protected Monuments of National Importance,,https://en.wikipedia.org/wiki/Undavalli_Caves,,,,,,,,,,,,,,,,,
Art,Srikalahasti kalamkari,Srikalahasti of Tirupati district,Andhra_Pradesh,"A traditional hand-painted textile art form known for its intricate designs, natural dyes, and unique techniques ","where artists use a ""kalam"" (pen) to draw and paint intricate designs on fabric.",,,"A traditional hand-painted textile art form known for its intricate designs, natural dyes, and unique techniques where artists use a ""kalam"" (pen) to draw and paint intricate designs on fabric. ",,https://laasyaart.com/kalamkari-a-traditional-indian-art-of-perfection/,https://en.wikipedia.org/wiki/Srikalahasti_kalamkari,,,,,,,,,,,,,,,,
Art,Lepakshi temple frescos,Lepakshi,Andhra_Pradesh," The Paintings created during the 16th century, cover the ceilings and walls of the temple, depicting stories from mythology, religious texts, and courtly life","The paintings cover the ceilings of many parts of the temple, as well as the walls of the Virabhadra shrine,",,,"The Paintings created during the 16th century, cover the ceilings and walls of the temple, depicting stories from mythology, religious texts, and courtly life",,https://www.peepultree.world/livehistoryindia/story/monuments/the-painted-wonders-of-lepakshi?srsltid=AfmBOooBxsfQn1BX6pK7rXW3t8pQdKiLhr_7W01q_9UNz2z1ljYONm0O,https://www.incredibleindia.gov.in/en/andhra-pradesh/anantapur/lepakshi-temple,,,,,,,,,,,,,,,,
Costume,Mangalagiri cotton sarees,"Mangalagiri, a town in Guntur district",Andhra_Pradesh,"A traditional handloom cotton sarees known for their simple, elegant designs and the distinctive ""Nizam Border""",is produced by weaving with the help of pitlooms from combed yarn by warp and woof interlacing. ,,,"A traditional handloom cotton sarees known for their simple, elegant designs and the distinctive ""Nizam Border""",,https://www.utsavpedia.com/textiles/mangalgiri-sari-from-the-fine-edges-of-andhra-pradesh/,https://en.wikipedia.org/wiki/Mangalagiri_sarees_and_fabrics,,,,,,,,,,,,,,,,
Dance_and_Music,Kuchipudi dance,Kuchipudi village,Andhra_Pradesh,"A classical dance style known for its graceful movements, intricate footwork, and expressive storytelling through dance ",often featuring both male and female dancers,,,"A classical dance style known for its graceful movements, intricate footwork, and expressive storytelling through dance ,often featuring both male and female dancers",,https://en.wikipedia.org/wiki/Kuchipudi,,,,,,,,,,,,,,,,,
Dance_and_Music,Dhimsa dance,Araku Valley and Borra Caves,Andhra_Pradesh,"A tribal dance form that is primarily performed by the Bagata, Valmiki, Poraja, Khond, Gadaba, Kondadora, Mukadora, and Kotia tribes",originated in Koraput district in the Odisha State,,,"A tribal dance form that is primarily performed by the Bagata, Valmiki, Poraja, Khond, Gadaba, Kondadora, Mukadora, and Kotia tribes",,https://en.wikipedia.org/wiki/Dhimsa,,,,,,,,,,,,,,,,,
Festival,Urus festival processions,Kadapa,Andhra_Pradesh,"The death anniversary of a Sufi saint, usually held at the saint's dargah ","often involve carrying the flag of the saint, music, and various rituals, attracting large crowds of devotees",It is generally played as a relief time during their working hours.,,"The death anniversary of a Sufi saint, usually held at the saint's dargah often involve carrying the flag of the saint, music, and various rituals, attracting large crowds of devotees",,https://www.thehindu.com/news/national/andhra-pradesh/urs-festival-draws-large-crowds/article34155262.ece,https://www.utsav.gov.in/public/view-event/ameen-peer-dargha-ursu-kadapa-1,,,,,,,,,,,,,,,,
