Attribute,unique artifact,Specific Location,state,Identifier1,Identifier2,Identifier3,Identifier4,Old Identifier,Influence Locations,Image Link1,Image Link2,,,"{Identifier} famous throughout India, originated in {specific location}",,,,,,,,,,,Attribute,state,
Cultural_Common_Sense,Konark Sun Temple,Konark,Odisha,A 13th-century CE Hindu Sun temple dedicated to the Hindu Sun-god Surya,artistic excellence,what remains of the temple complex has the appearance of a 100-foot (30 m) high chariot with immense wheels,"horses, all carved from stone","A 13th-century CE Hindu Sun temple dedicated to the Hindu Sun-god Surya, it reflects the pinnacle of kalingan architecture and artistic excellence, what remains of the temple complex has the appearance of a 100-foot (30 m) high chariot with immense wheels and horses, all carved from stone.",,https://en.wikipedia.org/wiki/Konark_Sun_Temple,,,,,,,,,,,,,,,,,
Cultural_Common_Sense,Ratha Yatra (Puri),Puri,Odisha,Oldest,largest Hindu chariot festival celebrated annually,on the bright half of the lunar month of Ashadh (JuneÃƒÂ¢Ã¢â€šÂ¬Ã¢â‚¬Å“July),,"Oldest and largest Hindu chariot festival celebrated annually, on the bright half of the lunar month of Ashadh (JuneÃƒÂ¢Ã¢â€šÂ¬Ã¢â‚¬Å“July)",,https://en.wikipedia.org/wiki/Ratha_Yatra_(Puri),,,,,,,,,,,,,,,,,
Cultural_Common_Sense,"Jagannath Temple, Puri",Puri,Odisha,A Hindu temple dedicated to the god Jagannath,a form of Vishnu in Hinduism,,,,,"https://en.wikipedia.org/wiki/Jagannath_Temple,_Puri",,,,,,,,,,,,,,,,,
Dance_and_Music,Ghumura Dance,Kalahandi district,Odisha,A folk dance that has the dress code of Ghumura,,,,,,https://en.wikipedia.org/wiki/Ghumura_dance,,,,,,,,,,,,,,,,,
Dance_and_Music,Mahuri,Mayurbhanj,Odisha,A wind instrument made of wood,auspicious occasions,"wedding, bratopanayan, social events",,"A wind instrument made of wood and metal this holds a special place in the cultural traditions used in religious ceremonies, wedding, bratopanayan, social events, and auspicious occasions",,"https://en.m.wikipedia.org/wiki/Mahuri_(instrument)#:~:text=The%20Mahuri%20is%20a%20wind%20instrument%20made,place%20in%20the%20cultural%20traditions%20of%20Odisha",,,,,,,,,,,,,,,,,
Dance_and_Music,Gotipua dance,Puri,Odisha,A traditional dance form performed in Orissa for centuries by young boys,Krishna.,,,"A traditional dance form performed in Orissa for centuries by young boys, who dress as women to praise Jagannath and Krishna.",,https://en.m.wikipedia.org/wiki/Gotipua,,,,,,,,,,,,,,,,,
Costume,Thewa jewelry,Pratapgarh,Rajasthan,A special art of jewelry making which involves fusing of intricately worked-out sheet gold on molten glass,,,,A special art of jewelry making which involves fusing of intricately worked-out sheet gold on molten glass,,https://en.wikipedia.org/wiki/Thewa,,,,,,,,,,,,,,,,,
History,Battle of Haldighati,Rajsamand,Rajasthan,"A battle fought on 18 June 1576 between the Mewar forces led by Maharana Pratap,",the Mughal forces led by Man Singh I of Amber.,,,"A battle fought on 18 June 1576 between the Mewar forces led by Maharana Pratap, and the Mughal forces led by Man Singh I of Amber.",,https://en.m.wikipedia.org/wiki/Battle_of_Haldighati,,,,,,,,,,,,,,,,,
Tourism,Chittorgarh Fort,Chittorgarh,Rajasthan,One of the largest forts that sprawls over a hill 180 m (590,6 ft) in height spread over an area of 280 ha (691,9 acres) above the plains of the valley drained by the Berach River,,One of the largest forts that sprawls over a hill 180 m (590.6 ft) in height spread over an area of 280 ha (691.9 acres) above the plains of the valley drained by the Berach River.,,https://en.m.wikipedia.org/wiki/Chittor_Fort,,,,,,,,,,,,,,,,,
Tourism,Kumbhalgarh Fort,Rajsamand,Rajasthan,A fortress on the westerly range of Aravalli Hills built during the 15th century by Rana Kumbha,,,,A fortress on the westerly range of Aravalli Hills built during the 15th century by Rana Kumbha.,,https://en.m.wikipedia.org/wiki/Kumbhalgarh,,,,,,,,,,,,,,,,,
Cuisine,Dal-Bati-Churma,"Jaipur,Jaisalmer",Rajasthan,A traditional delicacy associated with the festivals of Makar Sankranti,Diwali in the Dhundhand region prepared on special occasions like marriage ceremonies,housewarming,,A traditional delicacy associated with the festivals of Makar Sankranti and Diwali in the Dhundhand region prepared on special occasions like marriage ceremonies and housewarming.,,https://en.m.wikipedia.org/wiki/Dal_bati,,,,,,,,,,,,,,,,,
Cuisine,Bikaneri Bhujia in rajasthan,Bikaner,Rajasthan,"A crispy snack prepared by using Vigna aconitifolia, gram flour",spices light yellow in colour,,,"A crispy snack prepared by using Vigna aconitifolia, gram flour and spices light yellow in colour",,"https://en.m.wikipedia.org/wiki/Bikaneri_bhujia#:~:text=Bikaneri%20bhujia%2C%20often%20simply%20called,but%20also%20a%20generic%20name",,,,,,,,,,,,,,,,,
Dance_and_Music,Kalbelia dance,Jodhpur,Rajasthan,A folk dance that is an integral part of Kalbelia culture,a headcloth known as the odhani; the lower body cloth is called a lehenga,such as the pungi,"a woodwind instrument traditionally played to capture snakes, the dufli","A folk dance that is an integral part of Kalbelia culture,the dancers are women in flowing black skirts who dance and twirl, replicating the movements of a serpent. They wear an upper body cloth called an angrakhi and a headcloth known as the odhani; the lower body cloth is called a lehenga .The male participants play musical instruments, such as the pungi, a woodwind instrument traditionally played to capture snakes, the dufli, been, the khanjari - a percussion instrument, morchang, khuralio and the dholak to create the rhythm on which the dancers perform",,https://en.m.wikipedia.org/wiki/Kalbelia,,,,,,,,,,,,,,,,,
Dance_and_Music,Ghoomar Dance,Jodhpur,Rajasthan,A traditional folk dance performed by Bhil tribe to worship Goddess Saraswati this was later embraced by Rajputs,,,,A traditional folk dance performed by Bhil tribe to worship Goddess Saraswati this was later embraced by Rajputs,,https://en.m.wikipedia.org/wiki/Ghoomar,,,,,,,,,,,,,,,,,
Dance_and_Music,Maand in rajasthan,Jaisalmer,Rajasthan,"A combination of Classical, Cultural Singing, full of emotions",festival related programs organized by Maharajas.,this was sung in various cultural,,"A combination of Classical and Cultural Singing , full of emotions and has a test of Rajasthani rural traditions, in ancient ara of Rajputs, this was sung in various cultural and festival related programs organized by Maharajas.",,https://en.m.wikipedia.org/wiki/Mand_(singing_style),,,,,,,,,,,,,,,,,
Dance_and_Music,Chari Dance,"Ajmer,Kishangarh",Rajasthan,A female group dance prominent in Gurjar community during this colorfully dressed,deep swirls of knees.,"Often, the Chari are set on lit Diya (oil lamp)",fire with cotton seeds immersed in oil,"A female group dance prominent in Gurjar community during this colorfully dressed, bejeweled women hold earthenware or brass Chari pots on their heads. Often, the Chari are set on lit Diya (oil lamp) or fire with cotton seeds immersed in oil. Dancers carry a flaming pot on their head without touching it, while performing graceful movements of limbs and deep swirls of knees.",,https://en.m.wikipedia.org/wiki/Chari_Dance,,,,,,,,,,,,,,,,,
Dance_and_Music,Bhopa Bhopi Tradition,Bhilwara,Rajasthan,Priest-singers of the folk deities they perform in front of a scroll,known as phad,,,"Priest-singers of the folk deities they perform in front of a scroll, known as phad",,https://en.m.wikipedia.org/wiki/Bhopa,,,,,,,,,,,,,,,,,
Art,Pichwai Painting,Ahmedabad,Rajasthan,"Large devotional Hindu painted pictures, normally on cloth",this portray Krishna these are mainly made to hang in Hindu temples of the Pushtimarg devotional tradition,,,"Large devotional Hindu painted pictures, normally on cloth, this portray Krishna these are mainly made to hang in Hindu temples of the Pushtimarg devotional tradition",,https://en.m.wikipedia.org/wiki/Pichhwai,,,,,,,,,,,,,,,,,
Art,Kutch embroidery,Kutch,Gujarat,A handicraft,satin.,"in the form of a net using cotton, silk threads inn certain patterns",it is also crafted over silk,"A handicraft and textile signature art tradition of the tribal community practiced normally by women is generally done on fabrics of cotton, in the form of a net using cotton or silk threads inn certain patterns, it is also crafted over silk and satin.",,https://en.m.wikipedia.org/wiki/Kutch_Embroidery,,,,,,,,,,,,,,,,,
Art,Rogan Painting,Ahmedabad,Gujarat,"An art of cloth printing,they are of three type of",one is Rogan Art (Chhap),"second is Rogan Nirmika Art (Chhap), third is Rogan Varnika Art (Chhap)",,"An art of cloth printing,they are of three type of , one is Rogan Art (Chhap). second is Rogan Nirmika Art (Chhap), third is Rogan Varnika Art (Chhap).",,"https://en.m.wikipedia.org/wiki/Rogan_painting#:~:text=Rogan%20painting%20was%20initially%20practiced,decorate%20clothing%20for%20their%20weddings",,,,,,,,,,,,,,,,,
History,Lothal in gujarat,Ahmedabad,Gujarat,One of the southernmost sites of the ancient Indus Valley civilisation located in the Bhal region,,,,One of the southernmost sites of the ancient Indus Valley civilisation located in the Bhal region,,https://en.m.wikipedia.org/wiki/Lothal,,,,,,,,,,,,,,,,,
History,Mahatma Gandhi birthplace,Porbandar,Gujarat,"An Indian lawyer, anti-colonial nationalist,",political ethicist who employed nonviolent resistance to lead the successful campaign for India's independence from British rule,,,"An Indian lawyer, anti-colonial nationalist, and political ethicist who employed nonviolent resistance to lead the successful campaign for India's independence from British rule",,https://en.m.wikipedia.org/wiki/Mahatma_Gandhi,,,,,,,,,,,,,,,,,
Cultural_Common_Sense,Sun Temple at Modhera,Mehsana,Gujarat,A Hindu temple dedicated to the solar deity Surya located at Modhera village,,,,,,"https://en.m.wikipedia.org/wiki/Sun_Temple,_Modhera",,,,,,,,,,,,,,,,,
Festival,Bhavnath Mahadev Fair,Junagadh,Gujarat,A fair held at the Foothills of Girnar mountain on the banks of the river Suvarnarekha,,,,A fair held at the Foothills of Girnar mountain on the banks of the river Suvarnarekha,,https://en.m.wikipedia.org/wiki/Bhavnath_fair,,,,,,,,,,,,,,,,,
Festival,Uttarayan in gujarat,Ahmedabad,Gujarat,An annual kite festival held in January to celebrate the days in the Hindu calendar when winter begins turning to summer this is the sign for farmers that the sun is back,that harvest season,"Makara Sankranti/Mahasankranti, is approaching",This is considered one of the most important harvest days as it also marks the end of winter,"An annual kite festival held in January to celebrate the days in the Hindu calendar when winter begins turning to summer this is the sign for farmers that the sun is back and that harvest season, Makara Sankranti/Mahasankranti, is approaching. This is considered one of the most important harvest days as it also marks the end of winter and the beginning of the harvest season",,https://en.m.wikipedia.org/wiki/International_Kite_Festival_in_Gujarat_%E2%80%93_Uttarayan,,,,,,,,,,,,,,,,,
Festival,Vautha Mela,Ahmedabad,Gujarat,A fair held at Vautha village of Dholka taluka,the place of the fair is known as Saptasangam - the confluence of seven rivers,,,"A fair held at Vautha village of Dholka taluka ,the place of the fair is known as Saptasangam - the confluence of seven rivers",,"https://en.m.wikipedia.org/wiki/Vautha_fair#:~:text=seven%20rivers%20here.-,Time,Sud%20Purnima%20(Dev%20Deepavali)",,,,,,,,,,,,,,,,,
Festival,Dangs Darbar,Dang,Gujarat,A fair organized during the Holi festival in Ahwa,,,,,,https://en.m.wikipedia.org/wiki/Dangs_Darbar,,,,,,,,,,,,,,,,,
Festival,Shamlaji melo,Arvalli,Gujarat,A fair held in the month of November every year this lasts for about two weeks devotees belonging to various castes,communities including the Garasias and Bhils throng this festival.,,,A fair held in the month of November every year this lasts for about two weeks devotees belonging to various castes and communities including the Garasias and Bhils throng this festival.,,https://gujaratindia.gov.in/Home/ShamlajiFair,,,,,,,,,,,,,,,,,
Language,Kutchi language,Kutch,Gujarat,"An Indo-Aryan language, the Jadeja rulers of Cutch, Rajputs of Kutch",speak this language,,,"An Indo-Aryan language ,the Jadeja rulers of Cutch and Rajputs of Kutch, speak this language",Rajasthan,https://en.m.wikipedia.org/wiki/Kutchi_language,,,,,,,,,,,,,,,,,
Cultural_Common_Sense,Siddi community in gujarat,Junagadh,Gujarat,A community also known by different synonyms such as Habshi,Badsha it is believed that they are of African origin,,,A community also known by different synonyms such as Habshi and Badsha it is believed that they are of African origin.,,"https://trti.gujarat.gov.in/siddi#:~:text=At%20present%20the%20Siddis%20are,of%20Siddi%20tribe%20was%2054291",,,,,,,,,,,,,,,,,
Tourism,Panchmahal Gujarati,Panchmahal,Gujarat,"A district in the eastern portion which means ""five tehsils/talukas"" (5 sub-divisions)",refers to the five sub-divisions that were transferred by the Maharaja Jivajirao Scindia of Gwalior State to the British,,,"A district in the eastern portion which means ""five tehsils/talukas"" (5 sub-divisions), and refers to the five sub-divisions that were transferred by the Maharaja Jivajirao Scindia of Gwalior State to the British",,https://en.m.wikipedia.org/wiki/Panchmahal_district,,,,,,,,,,,,,,,,,
Dance_and_Music,Garba,Ahmedabad,Gujarat,A form of Circle dance,"Social dance this is traditionally danced as part of the annual Hindu festival of Navratri (or ""Nine Nights"")","held in celebration of Amba Mata, or the primordial mother",,"A form of Circle dance and Social dance this is traditionally danced as part of the annual Hindu festival of Navratri (or ""Nine Nights""), held in celebration of Amba Mata, or the primordial mother",,https://en.m.wikipedia.org/wiki/Garba_(dance),,,,,,,,,,,,,,,,,
History,Salt March,Dandi,Gujarat,"An act of non violent civil disobedience , led by Mahatma Gandhi",nonviolent protest against the British salt monopoly,Another reason for this march was that the Civil Disobedience Movement needed a strong inauguration that would inspire more people to follow Gandhi's example,Gandhi started this march with 78 of his trusted volunteers,"An act of non violent civil disobedience , led by Mahatma Gandhi. The 24-day march lasted from 12 March 1930 to 6 April 1930 as a direct action campaign of tax resistance and nonviolent protest against the British salt monopoly. Another reason for this march was that the Civil Disobedience Movement needed a strong inauguration that would inspire more people to follow Gandhi's example. Gandhi started this march with 78 of his trusted volunteers.",,https://en.wikipedia.org/wiki/Salt_March,,,,,,,,,,,,,,,,,
History,Buddhist caves near Udayagiri,Vidisha,Madhya_Pradesh,The twenty rock-cut caves primarily denoted to the Hindu gods Vishnu,Shiva from the early years of the 3rd century CE to 5th century CE,,,The twenty rock-cut caves primarily denoted to the Hindu gods Vishnu and Shiva from the early years of the 3rd century CE to 5th century CE,,https://en.m.wikipedia.org/wiki/Udayagiri_Caves,,,,,,,,,,,,,,,,,
Tourism,Great Stupa of Sanchi,Raisen,Madhya_Pradesh,"A Buddhist complex, famous for its Great Stupa",on a hilltop at Sanchi Town,,,,,https://en.m.wikipedia.org/wiki/Sanchi,,,,,,,,,,,,,,,,,
Festival,Hingot Mela,Indore,Madhya_Pradesh,An age old tradition of residents of Gautampura this is observed on dhok padwa (a day after Diwali),,,,An age old tradition of residents of Gautampura this is observed on dhok padwa (a day after Diwali),,https://en.m.wikipedia.org/wiki/Hingot_war,,,,,,,,,,,,,,,,,
Costume,Bagh Print,Dhar,Madhya_Pradesh,A traditional Indian handicraft originating in Bagh,,,,,,"https://en.m.wikipedia.org/wiki/Bagh_print#:~:text=at%20Bagh%20Caves.-,Dyes,dhavdi%20leaves%2C%20or%20pomegranate%20rinds",,,,,,,,,,,,,,,,,
Festival,Lokrang Festival,Bhopal,Madhya_Pradesh,An event organised each year by the Directorate of Culture,this state's Tribal Museum this is a five day cultural extravaganza,,,An event organised each year by the Directorate of Culture and this state's Tribal Museum this is a five day cultural extravaganza,,https://utsav.gov.in/view-event/lokrang-festival-1,,,,,,,,,,,,,,,,,
Tourism,Marble Rocks and Dhuandhar Falls,Jabalpur,Madhya_Pradesh,An area along the Narmada River in Bhedaghat,,,,,,https://en.m.wikipedia.org/wiki/Marble_Rocks,https://en.m.wikipedia.org/wiki/Dhuandhar_Falls,,,,,,,,,,,,,,,,
Tourism,Pachmarhi,Hoshangabad,Madhya_Pradesh,A hill station,this has been the location of a cantonment (Pachmarhi Cantonment) since the British Raj,,,"A hill station.,this has been the location of a cantonment (Pachmarhi Cantonment) since the British Raj",,https://en.m.wikipedia.org/wiki/Pachmarhi,,,,,,,,,,,,,,,,,
Tourism,Orchha,Niwari,Madhya_Pradesh,A town established by a Bundela Rajput ruler Rudra Pratap Singh some time after 1501,,,,"A town established by a Bundela Rajput ruler Rudra Pratap Singh some time after 1501,",,https://en.m.wikipedia.org/wiki/Orchha,,,,,,,,,,,,,,,,,
Art,Sawantwadi Craft,Sawantwadi,Maharashtra,A hand made work of art made of wood It is reported that the makers of these toys face the challenge of competition from mass-produced cheap Chinese products,,,,A hand made work of art made of wood It is reported that the makers of these toys face the challenge of competition from mass-produced cheap Chinese products.,,https://en.m.wikipedia.org/wiki/Sawantwadi_toys,,,,,,,,,,,,,,,,,
Tourism,Ajanta and Ellora Caves,Aurangabad,Maharashtra,Rock-cut Buddhist cave monuments dating from the second century BCE to about 480,,,,,,https://en.wikipedia.org/wiki/Ajanta_Caves,,,,,,,,,,,,,,,,,
Tourism,Gateway of India,Mumbai,Maharashtra,An arch-monument completed in 1924 on the waterfront it was erected to commemorate the landing of George V for his coronation as the Emperor of India in December 1911 at Strand Road near Wellington Fountain,,,,An arch-monument completed in 1924 on the waterfront it was erected to commemorate the landing of George V for his coronation as the Emperor of India in December 1911 at Strand Road near Wellington Fountain.,,https://en.m.wikipedia.org/wiki/Gateway_of_India,,,,,,,,,,,,,,,,,
Personalities,Bal Gangadhar Tilak,Ratnagiri,Maharashtra,"An Indian nationalist, teacher, an independence activist, one of the first","I shall have it. ""","Lala Lajpat Rai, Aurobindo Ghose, V. O",Chidambaram Pillai and Muhammad Ali Jinnah,"An Indian nationalist, teacher, and an independence activist, one of the first and strongest advocates of Swaraj ('self-rule') . He is known for his quote in Marathi: ""Swaraj is my birthright and I shall have it!"". He formed a close alliance with many Indian National Congress leaders including Bipin Chandra Pal, Lala Lajpat Rai, Aurobindo Ghose, V. O. Chidambaram Pillai and Muhammad Ali Jinnah",,https://en.m.wikipedia.org/wiki/Bal_Gangadhar_Tilak,,,,,,,,,,,,,,,,,
Cultural_Common_Sense,Pandharpur Wari Pilgrimage,Pandharpur,Maharashtra,A yatra to honor Vithoba,Tukaram,Many pilgrims join this procession on foot,"Warkari is a Marathi term which means ""one who performs the wari""","A yatra to honor Vithoba, it involves carrying the paduka of a saint in a palkhi, most notably of Dnyaneshwar and Tukaram, . Many pilgrims join this procession on foot. Warkari is a Marathi term which means ""one who performs the wari"". The tradition is more than 700 to 800 years old",,https://en.m.wikipedia.org/wiki/Pandharpur_Wari,,,,,,,,,,,,,,,,,
Festival,Narali Purnima Festival,Mumbai,Maharashtra,A festival celebrated to mark the end of the monsoon season,start-off with their trade.,,,"A festival celebrated to mark the end of the monsoon season, as the fishermen now can begin fishing safely and start-off with their trade.",,"https://utsav.gov.in/view-event/narali-purnima#:~:text=Narali%20Poornima%20is%20a%20ceremonial%20day%20observed%20by%20Hindu%20fishing,falls%20around%20July%20or%20August",,,,,,,,,,,,,,,,,
Festival,Bail Pola Festival,Pune,Maharashtra,A celebration to honour the bulls that pull their ploughs,prepare the land for planting and harvesting.,,,"A celebration to honour the bulls that pull their ploughs, allowing them to plant crops and prepare the land for planting and harvesting.",,https://maharashtratourism.gov.in/festivals/bail-pola/,https://en.m.wikipedia.org/wiki/Pola_(festival),,,,,,,,,,,,,,,,
Cuisine,Misal Pav,Kolhapur,Maharashtra,A dish consisting of a vegetable curry mostly made from moth beans which is a type of Indian bread roll,,,,A dish consisting of a vegetable curry mostly made from moth beans which is a type of Indian bread roll.,,https://en.m.wikipedia.org/wiki/Misal_pav,,,,,,,,,,,,,,,,,
Dance_and_Music,Lavani,Solapur,Maharashtra,A combination of traditional song,dance particularly performed to the beats of Dholki,a percussion instrument,,"A combination of traditional song and dance particularly performed to the beats of Dholki, a percussion instrument.",,https://en.m.wikipedia.org/wiki/Lavani,,,,,,,,,,,,,,,,,
Tourism,Mahabaleshwar,Satara,Maharashtra,A place of pilgrimage for Hindus because the Krishna River has its origin there,,,,,,https://en.m.wikipedia.org/wiki/Mahabaleshwar,,,,,,,,,,,,,,,,,
History,Basilica of Bom Jesus,Old Goa,Goa,"A Catholic basilica in the Konkan region ,this is a pilgrimage centre",recognised by UNESCO as a World Heritage Site,,,"A Catholic basilica in the Konkan region ,this is a pilgrimage centre and recognised by UNESCO as a World Heritage Site",,https://en.m.wikipedia.org/wiki/Basilica_of_Bom_Jesus,,,,,,,,,,,,,,,,,
Festival,Carnival Festival,"Major cities like Panaji, Margao, and Vasco da Gama",Goa,One of the few traditional celebrations of the Western Christian holiday,imposed in 1965 to attract tourists,It has since turned into a major tourist attraction for the small state,,"One of the few traditional celebrations of the Western Christian holiday ,the current version of this was modelled after the Rio Carnival by a local Goan musician named Timoteo Fernandes and imposed in 1965 to attract tourists. It has since turned into a major tourist attraction for the small state.",,"https://en.m.wikipedia.org/wiki/Carnival_in_Goa#:~:text=Balloons%2C%20horse%2Ddrawn%20carriages%2C,parades%2C%20and%20food%20and%20drinking",,,,,,,,,,,,,,,,,
History,Annexation of Goa,"Panaji, Goa",Goa,"A process in which the Republic of India annexed the Portuguese State of India,",,,,,,https://en.m.wikipedia.org/wiki/Annexation_of_Goa,,,,,,,,,,,,,,,,,
Festival,Sao Jao festival,Divar Island,Goa,An annual Catholic religious festival celebrated on 24 June,,,,,,"https://en.m.wikipedia.org/wiki/S%C3%A3o_Jo%C3%A3o_Festival_in_Goa#:~:text=Another%20tradition%20involves%20creating%20effigies,the%20village%20cross%20or%20chapel",,,,,,,,,,,,,,,,,
Festival,Bonderam Festival,Divar Island and SÃƒÆ’Ã‚Â£o Matias,Goa,A centuries old festival evolved from our ancestors,the Kadamba dynasty to the Portuguese,,,"A centuries old festival evolved from our ancestors, the Kadamba dynasty to the Portuguese.",,https://utsav.gov.in/view-event/bonderam-flag-festival,,,,,,,,,,,,,,,,,
Personalities,Feast of St. Francis Xavier,"Basilica of Bom Jesus, Old Goa",Goa,A Navarrese cleric,missionary,who co-founded the Society of Jesus and,was a representative of the Portuguese Empire,"A Navarrese cleric and missionary.who co-founded the Society of Jesus and, was a representative of the Portuguese Empire",,"https://en.m.wikipedia.org/wiki/Francis_Xavier#:~:text=Francis%20Xavier%20is%20the%20patron,honour%20the%20region's%20cultural%20heritage",,,,,,,,,,,,,,,,,
Tourism,Zambaulim Village,South Goa district,Goa,A regional capital for the colonial Provincias de Zamboulim (also called Panchemal),,,,A regional capital for the colonial Provincias de Zamboulim (also called Panchemal),,https://en.m.wikipedia.org/wiki/Zambaulim,,,,,,,,,,,,,,,,,
Dance_and_Music,Fugdi,Konkan region of Goa and Maharashtra,Goa,A folk dance performed by the womenfolk of some communities of Konkanies,,,,,,https://en.m.wikipedia.org/wiki/Fugdi,,,,,,,,,,,,,,,,,
Cuisine,Feni,Ponda,Goa,A spiritous liquor type This word is derived from the Sanskrit word Ãƒ Ã‚Â¤Ã‚Â«Ãƒ Ã‚Â¥Ã¢â‚¬Â¡Ãƒ Ã‚Â¤Ã‚Â¨ phena,in Konkani Ãƒ Ã‚Â¤Ã‚Â«Ãƒ Ã‚Â¥Ã¢â‚¬Â¡Ãƒ Ã‚Â¤Ã‚Â£ fenn (froth); thought to come from the bubbles that form when the liquor is shaken inside a bottle,poured into a glass,,"A spiritous liquor type This word is derived from the Sanskrit word Ãƒ Ã‚Â¤Ã‚Â«Ãƒ Ã‚Â¥Ã¢â‚¬Â¡Ãƒ Ã‚Â¤Ã‚Â¨ phena, in Konkani Ãƒ Ã‚Â¤Ã‚Â«Ãƒ Ã‚Â¥Ã¢â‚¬Â¡Ãƒ Ã‚Â¤Ã‚Â£ fenn (froth); thought to come from the bubbles that form when the liquor is shaken inside a bottle or poured into a glass",,https://en.m.wikipedia.org/wiki/Feni_(liquor),,,,,,,,,,,,,,,,,
Dance_and_Music,Tiatr,"Panaji, other urban centers in Goa",Goa,A type of musical theatre popular among the Goan expatriate communities,incorporate elements such as music,"dance, and singing. Individuals who perform there are referred to as tiatrists.",,"A type of musical theatre popular among the Goan expatriate communities , and other cities with a significant presence of Konkani speakers. The plays are primarily performed in the Romi Konkani dialects and incorporate elements such as music, dance, and singing. Individuals who perform there are referred to as tiatrists.",,https://en.m.wikipedia.org/wiki/Tiatr,,,,,,,,,,,,,,,,,
