Attribute,unique artifact,Specific Location,state,Identifier1,Identifier2,Identifier3,Identifier4,Old Identifier,Influence Locations,Image Link1,Image Link2,,,"{Identifier} famous throughout India, originated in {specific location}",,,,,,,,,,,Attribute,state,
Tourism,Iron Pillar,Mehrauli,Delhi,A structure 7.21 metres (23 feet 8 inches) high with a 41-centimetre (16 in) diameter ,"that was constructed by Chandragupta II (reigned c. 375â€“415 CE), metals used in its construction have a rust-resistant composition. The pillar weighs moreÂ thanÂ sixÂ tonnes",,,"A structure 7.21 metres (23 feet 8 inches) high with a 41-centimetre (16 in) diameter that was constructed by Chandragupta II (reigned c. 375â€“415 CE), metals used in its construction have a rust-resistant composition. The pillar weighs moreÂ thanÂ sixÂ tonnes",,https://en.wikipedia.org/wiki/Iron_pillar_of_Delhi,,,,,,,,,,,,,,,,,
History,Ashokan Rock Edict,"near the Kailash Hills, in South Delhi",Delhi,"A series of edicts on the teachings of Buddha created by Ashoka, the Mauryan Emperor who ruled in the Indian subcontinent during the 3rd century BC. ",The Edicts of Ashoka were either carved on in-situ rocks or engraved on pillars erected throughout the empire.,"The first in-situ rock edict was discovered in  1966, and establishes the city's ancient historical link with the Ashokan eraÂ (273â€“236Â BC)",,"A series of edicts on the teachings of Buddha created by Ashoka, the Mauryan Emperor who ruled in the Indian subcontinent during the 3rd century BC. The Edicts of Ashoka were either carved on in-situ rocks or engraved on pillars erected throughout the empire.The first in-situ rock edict was discovered in  1966, and establishes the city's ancient historical link with the Ashokan eraÂ (273â€“236Â BC)",,https://en.wikipedia.org/wiki/Ashokan_Edicts_in_Delhi,,,,,,,,,,,,,,,,,
History,Mamluk  Dynasty,Northern India,Delhi,"The historiographical name or umbrella term used to refer to the three dynasties who ruled the Ghurid territories , from 1206 to 1290,the Qutbi dynasty (1206â€“1211), ",the first Ilbari or Shamsi dynasty (1211â€“1266) and the second Ilbari dynastyÂ (1266â€“1290).,,,"The historiographical name or umbrella term used to refer to the three dynasties who ruled the Ghurid territories , from 1206 to 1290,the Qutbi dynasty (1206â€“1211), the first Ilbari or Shamsi dynasty (1211â€“1266) and the second Ilbari dynastyÂ (1266â€“1290).",,https://en.wikipedia.org/wiki/Mamluk_dynasty_(Delhi),,,,,,,,,,,,,,,,,
Tourism,Silvassa,Silvassa,Dadra_and_Nagar_Haveli_and_Daman_and_Diu,"The largest city in the union territory,chosen as one of the hundred Indian cities in Government of India's flagship SmartÂ CitiesÂ Mission","The former official name of the city, during Portuguese rule, was Paço de Arcos (Engl.: ""palace of arches"", also spelled Paço d'Arcos), named after the town of that same name located in Oeiras, Lisbon.",,,"The largest city in the union territory,chosen as one of the hundred Indian cities in Government of India's flagship SmartÂ CitiesÂ Mission",,https://en.wikipedia.org/wiki/Silvassa,,,,,,,,,,,,,,,,,
Tourism,Diu Fort,Diu,Dadra_and_Nagar_Haveli_and_Daman_and_Diu,"The fortress, which was built in 1535 subsequent to a defense alliance forged by Bahadur Shah, the Sultan of Gujarat and the Portuguese when Humayun, ","the Mughal Emperor attempted to annex this territory. It was strengthened over the years, till 1546. ",The Portuguese ruled over this territory from 1537 until the Indian invasion of December 1961,,"The fortress, which was built in 1535 subsequent to a defense alliance forged by Bahadur Shah, the Sultan of Gujarat and the Portuguese when Humayun, the Mughal Emperor attempted to annex this territory. It was strengthened over the years, till 1546. The Portuguese ruled over this territory from 1537 until the Indian invasion of December 1961",,"https://en.wikipedia.org/wiki/Diu,_India",https://en.wikipedia.org/wiki/Diu_Fortress,,,,,,,,,,,,,,,,
History,Portuguese architectural influence,Silvassa,Dadra_and_Nagar_Haveli_and_Daman_and_Diu,"A state of the Portuguese Empire founded seven years after the discovery of the sea route to the Indian subcontinent by Vasco da Gama, a subject of the Kingdom of Portugal. ",The capital of Portuguese India served as the governing centre of a string of military forts and maritime ports scattered along the coasts of theÂ IndianÂ Ocean.,,,"A state of the Portuguese Empire founded seven years after the discovery of the sea route to the Indian subcontinent by Vasco da Gama, a subject of the Kingdom of Portugal. The capital of Portuguese India served as the governing centre of a string of military forts and maritime ports scattered along the coasts of theÂ IndianÂ Ocean.",,https://en.wikipedia.org/wiki/Portuguese_India,,,,,,,,,,,,,,,,,
Tourism,Varlis and Koknas,Palghar,Maharashtra,"An indigenous tribe (Adivasi),living in mountainous as well as coastal areas, have their own animistic beliefs, life, customs and traditions, ",and as a result of acculturation they have adopted many Hindu beliefs. The Warli speak the unwritten Varli language which belongs to the southern zone of the Indo-AryanÂ languages,,,"An indigenous tribe (Adivasi),living in mountainous as well as coastal areas, have their own animistic beliefs, life, customs and traditions, and as a result of acculturation they have adopted many Hindu beliefs. The Warli speak the unwritten Varli language which belongs to the southern zone of the Indo-AryanÂ languages",Gujarat,https://en.wikipedia.org/wiki/Warli,,,,,,,,,,,,,,,,,
Tourism,St. Paul's Church,Diu,Dadra_and_Nagar_Haveli_and_Daman_and_Diu," College of the Holy Spirit and Church of Our Lady of the Conception or Saint Paul is situated on the west coast of India, a Union Territory of India","The St. Paul’s Church, named after St. Paul, the Apostle of Jesus also known as the Apostle to the Gentiles, is still a functioning church and one of the three churches in Diu built by the Portuguese. ",It is considered one of the best examples of baroque architecture (artistic style) in India.,,"College of the Holy Spirit and Church of Our Lady of the Conception or Saint Paul is situated on the west coast of India, a Union Territory of India",,"https://en.wikipedia.org/wiki/St._Paul%27s_Church,_Diu",,,,,,,,,,,,,,,,,
Tourism,Nagoa Beach,Diu,Dadra_and_Nagar_Haveli_and_Daman_and_Diu,"The most beautiful and more popular beach, is located in Nagoa hamlet of Village Bucharwada, or find you napping under the rare palm trees filled with the soothingÂ breeze","a perfect semi circle beach where the gentle lapping waves beckon you to wade into them for a fun filled time of swimming, gambolling or just lolling around the soft sandy shores ",,,"The most beautiful and more popular beach, is located in Nagoa hamlet of Village Bucharwada, a perfect semi circle beach where the gentle lapping waves beckon you to wade into them for a fun filled time of swimming, gambolling or just lolling around the soft sandy shores or find you napping under the rare palm trees filled with the soothingÂ breeze",,https://diu.gov.in/tourist-place/nagoa-beach/,,,,,,,,,,,,,,,,,
History,Fortress of Panikotha,Diu,Dadra_and_Nagar_Haveli_and_Daman_and_Diu,"A magnificent stone structure in the sea, built right at the mouth of the creek, built during the Muslim domain by Malik Aiyaz,",served as an entry post to control the movement of the Merchant Ships entering for trading the rich Asian merchandise ,,,"A magnificent stone structure in the sea, built right at the mouth of the creek, built during the Muslim domain by Malik Aiyaz, served as an entry post to control the movement of the Merchant Ships entering for trading the rich Asian merchandise ",,https://diu.gov.in/tourist-place/the-fortress-of-panikotha/,,,,,,,,,,,,,,,,,
Tourism,Daman Ganga River,Nasik district,Maharashtra,"A river headwaters are on the western slope of the Western Ghats range,  It rises at an elevation of 950 m. ","Found at the mouth is heavy sedimentation and hence the depth of water is shallow, located on both banksÂ ofÂ theÂ river.",,,"A river headwaters are on the western slope of the Western Ghats range,  It rises at an elevation of 950 m. Found at the mouth is heavy sedimentation and hence the depth of water is shallow, located on both banksÂ ofÂ theÂ river.","Dadra_and_Nagar_Haveli_and_Daman_and_Diu and Gujarat states, Dadra_and_Nagar_Haveli_and_Daman_and_Diu ",https://en.wikipedia.org/wiki/Daman_Ganga_River,,,,,,,,,,,,,,,,,
Tourism,Bom Jesus Church,Daman,Dadra_and_Nagar_Haveli_and_Daman_and_Diu,"A masterful specimen of the brilliant engineering artistry of the Portuguese. Echoing the ethos of traditional Roman art and architecture,","The intricately carved gateways, ornate interiors and artistic wooden altars of this shrine have withstood the test of time. ","The richly carved entrance to the south, with the elevated faÃ§ade and lofty ceiling, is embellished with the aesthetically carved statues of six saints,","the church dedicated to Bom Jesus draws both, tourists and pilgrims, inÂ largeÂ numbers.","A masterful specimen of the brilliant engineering artistry of the Portuguese. The intricately carved gateways, ornate interiors and artistic wooden altars of this shrine have withstood the test of time. The richly carved entrance to the south, with the elevated faÃ§ade and lofty ceiling, is embellished with the aesthetically carved statues of six saints,Echoing the ethos of traditional Roman art and architecture, the church dedicated to Bom Jesus draws both, tourists and pilgrims, inÂ largeÂ numbers",,https://ddd.gov.in/places-centres/church-of-bom-jesus-moti-daman/,,,,,,,,,,,,,,,,,
Tourism,Hirwa Van Garden,Silvassa,Dadra_and_Nagar_Haveli_and_Daman_and_Diu,"A very neat, clean & well maintained small garden located at Piparia.","The garden has good greenery, beautiful plants & flowers and man-made waterfalls is the main attraction of this place,one can spend its time for some walking, chattingÂ &Â relaxation",,,"A very neat, clean & well maintained small garden located at Piparia. The garden has good greenery, beautiful plants & flowers and man-made waterfalls is the main attraction of this place,one can spend its time for some walking, chattingÂ &Â relaxation",,https://ddd.gov.in/gallery/hirwa-van-garden/,,,,,,,,,,,,,,,,,
Cultural_Common_Sense,Gangeshwar Temple,Fudam village,Dadra_and_Nagar_Haveli_and_Daman_and_Diu,A Hindu temple dedicated to Lord Shiva situated in the midst of the rocksÂ onÂ theÂ seashore," Once pilgrims enter the cave Lord Ganesha, Lord Vishnu, and Goddess Lakshmi can be sight then five shivalingas could visible in different sizes in middle of the sea water",,,A Hindu temple dedicated to Lord Shiva situated in the midst of the rocksÂ onÂ theÂ seashore,,https://en.wikipedia.org/wiki/Gangeshwar_Mahadev_Temple,,,,,,,,,,,,,,,,,
History,The Naida Caves,Diu,Dadra_and_Nagar_Haveli_and_Daman_and_Diu,"A big network of tunnels with square hewn steps, which is yet to be fully explored, constructed byÂ theÂ Portuguese.The place is also well connected byÂ road",It is believed that the Portuguese during their reign hacked building materials for constructing the fortress of Diu from these caves. Caves are formed as a result of different geological processes.,,,"A big network of tunnels with square hewn steps, which is yet to be fully explored, constructed byÂ theÂ Portuguese.The place is also well connected byÂ road",,https://ddd.gov.in/places-centres/naida-caves/,,,,,,,,,,,,,,,,,
Tourism,Vasona Lion Safari Park,Silvassa,Dadra_and_Nagar_Haveli_and_Daman_and_Diu,"A haven for wildlife enthusiasts,There are more than three lions in the safari park, which is sprawled over an area of 20 acres and bound byÂ aÂ 3-m-highÂ wall",The park is a part of Dadra and Nagar Haveli Wildlife Sanctuary and also shares the neighbourhood with the Satmalia Deer Park. ,,,"A haven for wildlife enthusiasts,There are more than three lions in the safari park, which is sprawled over an area of 20 acres and bound byÂ aÂ 3-m-highÂ wall",,https://dnh.gov.in/tourist-place/vasona-lion-safari/,,,,,,,,,,,,,,,,,
Cultural_Common_Sense,Tribal Cultural Museum,Silvassa,Dadra_and_Nagar_Haveli_and_Daman_and_Diu,A museum which displays the lifestyle and culture of tribes,"One can see ornaments, musical instruments, fishing tools, hunting gadgets, agricultural and other household articles used by the tribals ofÂ thisÂ territory",,,"A museum which displays the lifestyle and culture of tribes,One can see ornaments, musical instruments, fishing tools, hunting gadgets, agricultural and other household articles used by the tribals ofÂ thisÂ territory",,https://dnh.gov.in/tourist-place/tribal-museum-silvassa/,,,,,,,,,,,,,,,,,
Tourism,Devka Beach,Diu,Dadra_and_Nagar_Haveli_and_Daman_and_Diu,"A sight of pure beauty, like so many other beaches, this too is a massive, picturesque and quite unspoilt.","The place has clean waters, well-maintained shores and enough beauty for everybody. Also, there is a special Amusement Park here which houses huge fountains and playÂ areaÂ forÂ kids",,,"A sight of pure beauty, like so many other beaches, this too is a massive, picturesque and quite unspoilt. The place has clean waters, well-maintained shores and enough beauty for everybody. Also, there is a special Amusement Park here which houses huge fountains and playÂ areaÂ forÂ kids",,https://ddd.gov.in/places-centres/devka-beach-nani-daman/,,,,,,,,,,,,,,,,,
Tourism,The Fort Of Moti Daman,Daman,Dadra_and_Nagar_Haveli_and_Daman_and_Diu,"The Fort formally built originally by the Mughals and later Strenghtened by the Portuguese,the Myth of the Material used by the Mughals to build the fort StonesÂ sandÂ andÂ Jaggry","which encloses the Administrator’s Secretariat, the Government House, Cathedral of Bom Jesus, Dominican Monastery, Bocage House (also known as the poet house)",,,"The Fort formally built originally by the Mughals and later Strenghtened by the Portuguese,the Myth of the Material used by the Mughals to build the fort StonesÂ sandÂ andÂ Jaggry","Delhi-Mumbai , Mumbai-Ahmedabad",https://ddd.gov.in/places-centres/the-fort-of-moti-daman/,,,,,,,,,,,,,,,,,
Tourism,INS Khukri Memorial,Diu,Dadra_and_Nagar_Haveli_and_Daman_and_Diu,"A frigate of the Indian Navy.It was inaugurated on 15th December, 1999 ",is found erected on the hillock at Chakratirth beach. It is a replica of the INS KhukriÂ NavalÂ Ship,,,"A frigate of the Indian Navy.It was inaugurated on 15th December, 1999 and is found erected on the hillock at Chakratirth beach. It is a replica of the INS KhukriÂ NavalÂ Ship",,https://diu.gov.in/tourist-place/ins-khukri/,,,,,,,,,,,,,,,,,
Tourism,Satmaliya Deer Park,Silvassa,Dadra_and_Nagar_Haveli_and_Daman_and_Diu,"A wildlife sanctuary with many species of antelope. Many other animals including sambhar and chital deer, and blackbucks and a wide variety of birds ","including the flame back woodpecker, peacocks, and thrushes can be spotted. The machan (watchtower) near the water hole provides an incredible panoramic view of the sanctuary andÂ MadhubanÂ Dam",,,"A wildlife sanctuary with many species of antelope. Many other animals including sambhar and chital deer, and blackbucks and a wide variety of birds including the flame back woodpecker, peacocks, and thrushes can be spotted. The machan (watchtower) near the water hole provides an incredible panoramic view of the sanctuary andÂ MadhubanÂ Dam",,https://dnh.gov.in/tourist-place/satmalia-deer-sanctuary/,,,,,,,,,,,,,,,,,
Tourism,Nani Daman Fort,Daman,Dadra_and_Nagar_Haveli_and_Daman_and_Diu,"One of the most popular tourist spots, a preferred location for spending leisure time by the locals and tourists alike. ","The area comprises of Jetty Garden, the estuary, the dock, several fast food stalls, Saint Jerome Fort, which occupies Church of OurÂ LadyÂ ofÂ theÂ Sea",,,"One of the most popular tourist spots, a preferred location for spending leisure time by the locals and tourists alike. The area comprises of Jetty Garden, the estuary, the dock, several fast food stalls, Saint Jerome Fort, which occupies Church of OurÂ LadyÂ ofÂ theÂ Sea",,https://ddd.gov.in/places-centres/nani-daman-jetty/,,,,,,,,,,,,,,,,,
Cultural_Common_Sense,Swaminarayan Temple,Silvassa,Dadra_and_Nagar_Haveli_and_Daman_and_Diu,"A perfect example for architectural splendour,located on River DamanÂ GangaÂ banks","Dotted along the serene banks of the Daman Ganga River, the  Temple serves as a captivating sanctuary of spiritual bliss and architectural grandeur",,,"A perfect example for architectural splendour,located on River DamanÂ GangaÂ banks",,https://dnh.gov.in/tourist-place/baps-swaminarayan-temple/,,,,,,,,,,,,,,,,,
History,Lady of Rosary,Daman Fort,Dadra_and_Nagar_Haveli_and_Daman_and_Diu,It is celebrated on 7 October in the General Roman Calendar. 7 October is the anniversary of the decisive ,victory of the combined fleet of the Holy League of 1571 over the Ottoman navy at the BattleÂ ofÂ Lepanto,,,It is celebrated on 7 October in the General Roman Calendar. 7 October is the anniversary of the decisive victory of the combined fleet of the Holy League of 1571 over the Ottoman navy at the BattleÂ ofÂ Lepanto,,https://en.wikipedia.org/wiki/Our_Lady_of_the_Rosary,,,,,,,,,,,,,,,,,
Tourism,Zampa Gateway,Diu,Dadra_and_Nagar_Haveli_and_Daman_and_Diu,A captivating symbol of Portuguese heritage. This imposing structure welcomes visitors with its intricate architecture ,serves as a gateway to explore the island's cultural treasures and scenic beauty.It stands as an iconic representation of its heritage with its intricately carved patternsÂ andÂ sculptures,,,A captivating symbol of Portuguese heritage. This imposing structure welcomes visitors with its intricate architecture and serves as a gateway to explore the island's cultural treasures and scenic beauty.It stands as an iconic representation of its heritage with its intricately carved patternsÂ andÂ sculptures,,https://en.m.wikipedia.org/wiki/File:View_of_Zampa_Gateway_(cropped).JPG,,,,,,,,,,,,,,,,,
Tourism,Ghoghla Beach,Diu,Dadra_and_Nagar_Haveli_and_Daman_and_Diu,"One of the most attractive places,situated in the village of Ghoghla, which is around 15 km.","It is a popular tourist spot that has necessary facilities like food and accommodation, considered to be one of the most beautiful beautifulÂ beaches",,,"One of the most attractive places,situated in the village of Ghoghla, which is around 15 km.It is a popular tourist spot that has necessary facilities like food and accommodation, considered to be one of the most beautiful beautifulÂ beaches",,https://ddd.gov.in/places-centres/ghogla-beach/,,,,,,,,,,,,,,,,,
History,Diu Head,Diu,Dadra_and_Nagar_Haveli_and_Daman_and_Diu,"A headland in the Arabian Sea, located at the southern end of the Kathiawar Peninsula in the Union Territory and 17 km southeastÂ ofÂ KodinarÂ town",There is a lighthouse station on the point,,,"A headland in the Arabian Sea, located at the southern end of the Kathiawar Peninsula in the Union Territory and 17 km southeastÂ ofÂ KodinarÂ town",,https://en.wikipedia.org/wiki/Diu_Head,,,,,,,,,,,,,,,,,
Tourism,Nakshatra Garden,Silvassa,Dadra_and_Nagar_Haveli_and_Daman_and_Diu,"An Astro-themed garden, which has a large variety of plants and trees linked to zodiac signs. ",It has been designed according to the Indian system of astrology that links plants with the motion of different planets.,"A dedicated play area for kids, well-maintained garden also has numerous little ponds and various speciesÂ ofÂ trees",,"An Astro-themed garden, which has a large variety of plants and trees linked to zodiac signs. It has been designed according to the Indian system of astrology that links plants with the motion of different planets.A dedicated play area for kids, well-maintained garden also has numerous little ponds and various speciesÂ ofÂ trees",,https://dnh.gov.in/tourist-place/nakshatra-garden/,,,,,,,,,,,,,,,,,
Art,Xorai,Bajali district,Assam,"A manufactured bell metal product is one of the traditional symbols of Assam, which is considered as an article of great respect by the peopleThere are Xorais with or without a cover on the top.",.It is an offering tray with a stand at the bottom which is used in felicitations also.,Hajo and Sarthebari are the most important centers of traditional bell-metal andÂ brassÂ crafts,,"A manufactured bell metal product is one of the traditional symbols of Assam, which is considered as an article of great respect by the people.It is an offering tray with a stand at the bottom which is used in felicitations also.There are Xorais with or without a cover on the top. Hajo and Sarthebari are the most important centers of traditional bell-metal andÂ brassÂ crafts",,https://en.wikipedia.org/wiki/Xorai,,,,,,,,,,,,,,,,,
Costume,Assam Silk,"Sivasagar, Kamrup, and Goalpara",Assam,"Denotes the three major types of indigenous wild silks produced golden muga, white pat andÂ warmÂ eriÂ silk","silk industry, now centered in Sualkuchi, is a labor-intensive industry.",,,"Denotes the three major types of indigenous wild silks produced golden muga, white pat andÂ warmÂ eriÂ silk",,https://en.wikipedia.org/wiki/Assam_silk,,,,,,,,,,,,,,,,,
Cultural_Common_Sense,Satra,Bordowa,Assam,"Institutional centers associated with the Ekasarana tradition of Vaishnavism, Numbering in the hundreds, ","these centers are generally independent of each other and under the control of individual adhikara (or satradhikar), though they can be grouped into four different SanghatiÂ (orders)",,,"Institutional centers associated with the Ekasarana tradition of Vaishnavism, Numbering in the hundreds, these centers are generally independent of each other and under the control of individual adhikara (or satradhikar), though they can be grouped into four different SanghatiÂ (orders)",,https://en.wikipedia.org/wiki/Satra_(Ekasarana_Dharma),,,,,,,,,,,,,,,,,
History,Dubi Copper Plate Inscriptions,Dubi Village,Assam,"The inscriptions of a grant issued by Bhaskaravarman of Kamarupa, earliest of all copper plate grants issued by Kamarupa kings discovered so far.","This was an issue after an earlier charter, issued by Bhutivarman, was destroyed.","There are five copper plates in this collection, with seventy-six verses in Sanskrit, written in the eastern variety of North Indian alphabet prevalent in the sixth and seventhÂ centuries",,"The inscriptions of a grant issued by Bhaskaravarman of Kamarupa, earliest of all copper plate grants issued by Kamarupa kings discovered so far.This was an issue after an earlier charter, issued by Bhutivarman, was destroyed.There are five copper plates in this collection, with seventy-six verses in Sanskrit, written in the eastern variety of North Indian alphabet prevalent in the sixth and seventhÂ centuries",,https://en.wikipedia.org/wiki/Dubi_copperplate_inscription,,,,,,,,,,,,,,,,,
History,Deopahar,Golaghat district,Assam,"An archaeological site located in Numaligarh,one of the most noteworthy ancient heritages . ",Numaligarh is prominently known as one of the archaeologically rich places of the state because of the historical remains of the ancient temple and sculptures that were excavated from the topÂ ofÂ theÂ Deopahar,,,"An archaeological site located in Numaligarh,one of the most noteworthy ancient heritages . Numaligarh is prominently known as one of the archaeologically rich places of the state because of the historical remains of the ancient temple and sculptures that were excavated from the topÂ ofÂ theÂ Deopahar",,https://en.wikipedia.org/wiki/Deopahar,,,,,,,,,,,,,,,,,
Costume,Muga silk,"Sualkuchi, Kamrup district",Assam,A variety of wild silk geographically tagged to the state.The silk is known for its extreme durability ,"and the silk  has a natural yellowish-golden tint with a shimmering, glossy texture and was previously reserved for theÂ useÂ ofÂ royalty",,,"A variety of wild silk geographically tagged to the state.The silk is known for its extreme durability and has a natural yellowish-golden tint with a shimmering, glossy texture and was previously reserved for theÂ useÂ ofÂ royalty",,https://en.wikipedia.org/wiki/Muga_silk,,,,,,,,,,,,,,,,,
Costume,Gamosa,"Sualkuchi, Kamrup district",Assam,"An article of significance for the people, generally a white rectangular piece of cloth with primarily a red border on three sides and red woven motifs on the fourth. ","Although cotton yarn is the most common material for making/weaving gamosas, there are special occasion ones madeÂ fromÂ PatÂ silk",,,"An article of significance for the people, generally a white rectangular piece of cloth with primarily a red border on three sides and red woven motifs on the fourth. Although cotton yarn is the most common material for making/weaving gamosas, there are special occasion ones madeÂ fromÂ PatÂ silk",,https://en.wikipedia.org/wiki/Gamosa,,,,,,,,,,,,,,,,,
History,Ahom dynasty,"Brahmaputra Valley, Assam",Assam,"The dynasty was established by Sukaphaa, a Shan prince of Mong Mao who came after crossing the Patkai mountains.",The rule of this dynasty ended with the Burmese invasion and the subsequent annexation by the British East India Company following the Treaty of YandaboÂ inÂ 1826,,,"The dynasty was established by Sukaphaa, a Shan prince of Mong Mao who came after crossing the Patkai mountains. The rule of this dynasty ended with the Burmese invasion and the subsequent annexation by the British East India Company following the Treaty of YandaboÂ inÂ 1826",,https://en.wikipedia.org/wiki/Ahom_dynasty,,,,,,,,,,,,,,,,,
