Attribute,unique artifact,Specific Location,state,Identifier1,Identifier2,Identifier3,Identifier4,Old Identifier,Influence Locations,Image Link1,Image Link2,,,"{Identifier} famous throughout India, originated in {specific location}",,,,,,,,,,,Attribute,state,
History,Preserving India's Rich Heritage,Dzongu district,Sikkim,"A protected Lepcha reserve in Dzongu, legally designed to preserve their cultural heritage",under PRASAD (Pilgrimage Rejuvenation and Spiritual Augmentation Drive) scheme by the Government in its unwavering commitment to safeguarding India's ancient civilizational heritage.,,,"A protected Lepcha reserve in Dzongu, legally designed to preserve their cultural heritage",,https://en.wikipedia.org/wiki/Cultural_heritage,,,,,,,,,,,,,,,,,
Personalities,Author Amrita Pritam,Gujranwala,Punjab,The renowned Punjabiâ€‘Hindi poet and novelist born in Gujranwala on 31 August 1919,she is the recipient of the 1956 Sahitya Akademi Award.,,,The renowned Punjabiâ€‘Hindi poet and novelist born in Gujranwala on 31 August 1919,,https://en.wikipedia.org/wiki/Amrita_Pritam,,,,,,,,,,,,,,,,,
Costume,Parandi,Patiala,Punjab,"A multicolored silk tassel hair accessory worn by Punjabi women, especially from Patiala",is a part of traditional ethnic Punjabi clothing and a folk accessory of Punjabi culture. ,is a women's hair ornament made of multicolored silk threads and decorated with floral (bunches) designs and ornamental tassels.,,"A multicolored silk tassel hair accessory worn by Punjabi women, especially from Patiala",,https://en.wikipedia.org/wiki/Punjabi_paranda,,,,,,,,,,,,,,,,,
Costume,Khes,Malwa region and the Sangrur district,Punjab,i is generally hand-woven with coarse cotton yarns. ,as a garment is a simple clothing item to wear loosely to cover the upper body by men in Pakistan and northwest India.,,,"A traditional handâ€‘woven thick cotton blanket or wrap used as bedding/clothing, woven in Malwa/Sangrur",,https://en.wikipedia.org/wiki/Khes,,,,,,,,,,,,,,,,,
Dance_and_Music,Jhumar dance,Sandal Bar and Chaj doab regions,Punjab,"A slow, rhythmic male folk dance from Punjab, performed in a circle to emotional songs at weddings and melas",It is also known as the circular dance of Jats with hands joined all around and performed at weddings or whenever they happen to collect in large numbers.,,,"A slow, rhythmic male folk dance from Punjab, performed in a circle to emotional songs at weddings and melas",Punjab & Haryana,https://en.wikipedia.org/wiki/Jhumar,https://artandculturalaffairshry.gov.in/dance/,,,,,,,,,,,,,,,,
Dance_and_Music,Algoza wind instrument in punjab,Sangrur district,Punjab,"A paired woodwind traditional musical instrument of Sindhi culture, used in Punjabi folk music, providing melody and drone","It consists of two joined beak flutes, one for melody, the second for drone.",,,"A paired woodwind traditional musical instrument of Sindhi culture, used in Punjabi folk music, providing melody and drone",,https://en.wikipedia.org/wiki/Alghoza,,,,,,,,,,,,,,,,,
History,Jallianwala Bagh massacre,Amritsar,Punjab,"The Amritsar massacre took place on 13 April 1919, ","where Brigadier General Dyer ordered troops to fire on an unarmed crowd, killing at least 379 people and injuring over a thousand",,,"The Amritsar massacre took place on 13 April 1919, where Brigadier General Dyer ordered troops to fire on an unarmed crowd, killing at least 379 people and injuring over a thousand",,https://en.m.wikipedia.org/wiki/Jallianwala_Bagh_massacre,,,,,,,,,,,,,,,,,
History,Green Revolution,Ludhiana district,Punjab,"The agricultural transformation in the 1960s initiated from Punjab Agricultural University, Ludhiana, leading to major increases in crop yields","the Third Agricultural Revolution, was a period during which technology transfer initiatives resulted in a significant increase in crop yields.",,,"The agricultural transformation in the 1960s initiated from Punjab Agricultural University, Ludhiana, leading to major increases in crop yields",,"https://en.m.wikipedia.org/wiki/Green_Revolution_in_India#:~:text=In%20Punjab%2C%20where%20it%20was,were%20increasing%20by%20over%2070%25",,,,,,,,,,,,,,,,,
History,"Qila Mubarak, Bathinda",Bathinda,Punjab,Two distinctive historical sites associated with Sikh and Indo-Islamic architectural heritage,a heritage site dating back to early medieval times and preserved by the Archaeological Survey of India,,,"Two distinctive historical sites associated with Sikh and Indo-Islamic architectural heritage, a heritage site dating back to early medieval times and preserved by the Archaeological Survey of India",,https://en.m.wikipedia.org/wiki/Qila_Mubarak,,,,,,,,,,,,,,,,,
Dance_and_Music,Jhumar folk dance,"Sandal Bar,Chaj Doab",Punjab," A traditional Punjabi folk dance, originating from the Sandal Bar and Chaj Doab regions of Punjab. ","A slow, rhythmic male dance, performed in a circle to emotional songs at weddings and fairs",,,"A traditional Punjabi folk dance, originating from the Sandal Bar and Chaj Doab regions of Punjab. A slow, rhythmic male dance, performed in a circle to emotional songs at weddings and fairs",,https://en.wikipedia.org/wiki/Jhumar,,,,,,,,,,,,,,,,,
History,Partition Museum,Amritsar,Punjab,"The public museum located in Amritsarâ€™s Town Hall, opened on 25 Aug 2017","is dedicated to preserving stories, artefacts, and exhibits from the 1947 Partition",,,"The public museum located in Amritsarâ€™s Town Hall, opened on 25 Aug 2017, is dedicated to preserving stories, artefacts, and exhibits from the 1947 Partition",,https://en.wikipedia.org/wiki/Partition_Museum,,,,,,,,,,,,,,,,,
Tourism,Mahendra Chaudhary Zoological Park,Zirakpur,Chandigarh,"A zoological park, situated close to Zirakpur, established in 1977, Punjabâ€™s","largest zoo, featuring a lion safari and diverse fauna",,,"A zoological park, situated close to Zirakpur, established in 1977, Punjabâ€™s largest zoo, featuring a lion safari and diverse fauna",,https://en.wikipedia.org/wiki/Mahendra_Chaudhary_Zoological_Park,,,,,,,,,,,,,,,,,
History,Manimajra Fort,Mani Majra,Chandigarh,"A 360â€‘yearâ€‘old Nanak Shahi brick fort built by Gharib Dass Dhillon,",now deteriorating and under Meharwal Khewaji Trustâ€™s oversight,,,"A 360â€‘yearâ€‘old Nanak Shahi brick fort built by Gharib Dass Dhillon, now deteriorating and under Meharwal Khewaji Trustâ€™s oversight",,https://en.wikipedia.org/wiki/Manimajra_Fort,,,,,,,,,,,,,,,,,
Festival,Kang festival,Imphal district,Manipur,A traditional Meitei lunar ritual festival held in Imphal celebrating agricultural and cultural traditions,"also known as the Ratha Yatra of Manipur, is a prominent religious festival celebrated by the Meitei community of Manipur.",This festival showcases the rich cultural heritage of Manipur and reflects the community’s devotion to Lord Jagannath.,,A traditional Meitei lunar ritual festival held in Imphal celebrating agricultural and cultural traditions,,https://blog.mygov.in/festivals-of-manipur-kang/,,,,,,,,,,,,,,,,,
Rituals_and_Ceremonies,Heikru Hidongba,Imphal West district,Manipur,A royal boat-race ceremony on the Imphal River performed annually by Meitei royalty,"performed every year at the moat of the Sagolband Bijoy Govinda Leikai, Imphal on the 11th day of the Meitei calendar month Langban",,,A royal boat-race ceremony on the Imphal River performed annually by Meitei royalty,,https://en.wikipedia.org/wiki/Heikru_Hidongba,,,,,,,,,,,,,,,,,
Art,Textile weaving,BIshnupur district,Manipur,A centuries-old Meitei handloom tradition from Bishnupur producing fine phanek and other textiles,is a method of textile production [a] in which two distinct sets of yarns or threads are interlaced at right angles to form a fabric or cloth,,,A centuries-old Meitei handloom tradition from Bishnupur producing fine phanek and other textiles,,https://ignca.gov.in/divisionss/janapada-sampada/northeastern-regional-centre/textiles-of-manipur/,,,,,,,,,,,,,,,,,
Tourism,Loktak Lake,Bishnupur district,Manipur,"The worldâ€™s only floating lake (phumdis), a Ramsar wetland and eco-tourism hub","is a freshwater lake in Northeast India. It is a pulsating lake, with a surface area varying from 250 km2 to 500 km2 during the rainy season with a typical area of 287 km2.",,,"The worldâ€™s only floating lake (phumdis), a Ramsar wetland and eco-tourism hub",,https://en.wikipedia.org/wiki/Loktak_Lake,,,,,,,,,,,,,,,,,
Cultural_Common_Sense,Ima Market,Imphal,Manipur,The worldâ€™s largest all-women market run entirely by Meitei women since the 16th century,"also known as the Nupi Keithel (English: Women's Market) or the Khwairamband Keithel (English: Khwairamband Market), ",,,The worldâ€™s largest all-women market run entirely by Meitei women since the 16th century,,https://en.m.wikipedia.org/wiki/Ima_Market,,,,,,,,,,,,,,,,,
Tourism,Khogampatt Gardens,Imphal west district,Manipur,A historical royal garden in Imphal West established by Manipur royalty,"is a botanical garden in Imphal, Manipur, India. It is dedicated to the collection, cultivation, preservation and display of a wide range of 500 varieties of orchids ",,,A historical royal garden in Imphal West established by Manipur royalty,,https://en.m.wikipedia.org/wiki/Khonghampat_Orchidarium,,,,,,,,,,,,,,,,,
Religion,Shri Shri Govindajee Temple,Imphal,Manipur,A 19th century Vaishnavite temple in Imphal housing the divine idol of Lord Govindaji,dedicated to Hindu deities Radha Krishna (Govindaji). It is the largest Vaishnava temple in Imphal district ,,,A 19th century Vaishnavite temple in Imphal housing the divine idol of Lord Govindaji,,https://artsandculture.google.com/entity/shri-shri-govindaji-temple/m0kg13ps?hl=en,,,,,,,,,,,,,,,,,
Tourism,Keibul Lamjao National Gardens,Bishnupur district,Manipur,The worldâ€™s only floating national park established in 1977 for the endangered Sangai deer on Loktak Lake,is characterized by floating decomposed plant material locally called phumdi.,,,The worldâ€™s only floating national park established in 1977 for the endangered Sangai deer on Loktak Lake,,https://en.m.wikipedia.org/wiki/Keibul_Lamjao_National_Park,,,,,,,,,,,,,,,,,
Dance_and_Music,Manipuri Raas Leela,Imphal,Manipur,A devotional Manipuri dance-drama of Radhaâ€‘Krishna performed at the Govindaji Temple,is considered to be the highest spiritual expression of the worship of Hindu deity Krishna.,,,A devotional Manipuri dance-drama of Radhaâ€‘Krishna performed at the Govindaji Temple,,https://en.m.wikipedia.org/wiki/Manipuri_dance,,,,,,,,,,,,,,,,,
Cultural_Common_Sense,Meitei Commmunity,Imphal Valley,Manipur,"The predominant ethnic group of Manipur with distinct language, script (Meitei Mayek), and traditions",They form the largest and dominant ethnic group of Manipur in Northeast India.,,,"The predominant ethnic group of Manipur with distinct language, script (Meitei Mayek), and traditions",,https://en.m.wikipedia.org/wiki/Meitei_people,,,,,,,,,,,,,,,,,
Language,Puyas,Imphal,Manipur,"Ancient Meitei scripture manuscripts written in the Meitei Mayek script, central to Sanamahism and Meitei identity","They encompass a wide spectrum of themes including genealogy, literature, history, royalties, administration, creation and cosmology, philosophy, poetry, religious beliefs",,,"Ancient Meitei scripture manuscripts written in the Meitei Mayek script, central to Sanamahism and Meitei identity",,https://en.m.wikipedia.org/wiki/Puya_(Meitei_texts),,,,,,,,,,,,,,,,,
Art,Thang-Ta,mphal West and Bishnupur,Manipur,"A traditional Manipuri martial art combining armed and unarmed combat forms, integral to cultural heritage","It is practised using weaponry. It is considered as the sibling of Sarit Sarak, which uses no weapons. ",,,"A traditional Manipuri martial art combining armed and unarmed combat forms, integral to cultural heritage",,https://en.m.wikipedia.org/wiki/Thang_Ta,,,,,,,,,,,,,,,,,
Dance_and_Music,Pena,Birbhum district,Manipur,"A traditional Manipuri string instrument used in folk music and rituals, known for its haunting melody","It is the traditional musical instrument of Manipur, used mainly in the Lai Haraoba festival of Sanamahism.",,,"A traditional Manipuri string instrument used in folk music and rituals, known for its haunting melody",,https://en.m.wikipedia.org/wiki/Pena_(musical_instrument),,,,,,,,,,,,,,,,,
Language,Meitei language,"Thoubal , Imphal East , Imphal West",Manipur,The Sino-Tibetan language spoken by the Meitei people,"written in Meitei Mayek script, and official in Manipur",,,"The Sino-Tibetan language spoken by the Meitei people, written in Meitei Mayek script, and official in Manipur",,https://en.m.wikipedia.org/wiki/Meitei_language,,,,,,,,,,,,,,,,,
Festival,Cheiraoba,Imphal district,Manipur,"The Manipuri New Year festival celebrated with offerings, feasting, and traditional rituals in April","also called Meitei Cheiraoba (Meitei for 'Meitei New Year') or Sajibu Cheiraoba (Meitei for 'Sajibu New Year'), is the lunar new year festival of the Meitei people who follow Sanamahism ",,,"The Manipuri New Year festival celebrated with offerings, feasting, and traditional rituals in April",,https://blog.mygov.in/festivals-of-manipur-cheiraoba/,,,,,,,,,,,,,,,,,
Tourism,Keibul Lamjao National Park,Bishnupur district,Manipur,"The worldâ€™s only floating national park, habitat of the endangered Sangai deer on Loktak Lake",The national park is characterized by floating decomposed plant material locally called phumdi,,,"The worldâ€™s only floating national park, habitat of the endangered Sangai deer on Loktak Lake",,https://en.m.wikipedia.org/wiki/Keibul_Lamjao_National_Park,,,,,,,,,,,,,,,,,
Festival,Yaosang,Imphal Valley,Manipur,"The Manipuri version of Holi festival, celebrated with colors, traditional sports, and cultural events","begins just after sunset in every village with the Yaosang Mei thaba, or Burning of the Straw Hut on the night of the fullmoon of Manipuri month of Lamta",,,"The Manipuri version of Holi festival, celebrated with colors, traditional sports, and cultural events",,https://en.m.wikipedia.org/wiki/Yaosang,,,,,,,,,,,,,,,,,
Personalities,Mary Kom,Churachandpur district,Manipur,"An acclaimed Indian boxer and six-time world champion, known as â€œMagnificent Mary,â€ from Manipur.","is an Indian Olympic boxer, politician, and former Member of Rajya Sabha",,,"An acclaimed Indian boxer and six-time world champion, known as â€œMagnificent Mary,â€ from Manipur.",,https://en.wikipedia.org/wiki/Mary_Kom,,,,,,,,,,,,,,,,,
Personalities,Irom Sharmila Chanu,Imphal,Manipur,"A prominent civil rights activist and poet, known for her prolonged hunger strike against AFSPA.","""Iron Lady of Manipur"" or ""Mengoubi"" (""the fair one"") is an Indian civil rights activist, political activist, and poet from the Indian state of Manipur",,,"A prominent civil rights activist and poet, known for her prolonged hunger strike against AFSPA.",,https://en.wikipedia.org/wiki/Irom_Sharmila_Chanu,,,,,,,,,,,,,,,,,
Personalities,Saikhom Mirabai Chanu,Imphal East district,Manipur,"An Olympic silver medalist weightlifter, hailed as one of Indiaâ€™s top sportswomen from Manipur.",She has won gold medals at the World Championships and Commonwealth Games. She was awarded the Padma Shri and Major Dhyan Chand Khel Ratna by the Government of India in 2018.,,,"An Olympic silver medalist weightlifter, hailed as one of Indiaâ€™s top sportswomen from Manipur.",,https://en.wikipedia.org/wiki/Saikhom_Mirabai_Chanu,,,,,,,,,,,,,,,,,
Personalities,Aribam Syam Sharma,Imphal,Manipur,"A celebrated filmmaker and composer, known for contributions to Manipuri cinema and culture.",his  movie Lamja Parshuram. It became the first Manipuri film to run for 100 days in the box office. ,,,"A celebrated filmmaker and composer, known for contributions to Manipuri cinema and culture.",,https://en.wikipedia.org/wiki/Aribam_Syam_Sharma,,,,,,,,,,,,,,,,,
Personalities,Angom Anita Chanu,Mayang,Manipur,"An international judoka representing India, known for multiple medals in Asian competitions.",She won her bronze medal at Asian Judo Championship at Bangkok in 2013 by defeating Kazakhstan’s Olessya Kutsenko.,,,"An international judoka representing India, known for multiple medals in Asian competitions.",,https://en.wikipedia.org/wiki/Angom_Anita_Chanu,,,,,,,,,,,,,,,,,
Personalities,Dingko Singh,Sekta,Manipur,"A legendary Indian boxer who won gold at the 1998 Asian Games, inspiring many in Manipur and India.",He won the King's Cup in Bangkok in 1997 and the Asian Games gold in the 1998 Bangkok Games.,,,"A legendary Indian boxer who won gold at the 1998 Asian Games, inspiring many in Manipur and India.",,https://en.wikipedia.org/wiki/Dingko_Singh,,,,,,,,,,,,,,,,,
Personalities,Kunjarani Devi,Imphal,Manipur,An award-winning Indian weightlifter and multiple Commonwealth Games medalist from Manipur.,She started taking interest in sports while still in Imphal's Sindam Sinshang Resident High School in 1978.,,,An award-winning Indian weightlifter and multiple Commonwealth Games medalist from Manipur.,,https://en.wikipedia.org/wiki/Kunjarani_Devi,,,,,,,,,,,,,,,,,
Personalities,Laishram Sarita Devi,Thoubal district,Manipur,An accomplished Indian boxer with multiple international medals and a strong sports legacy.,"She is a national champion and a former world champion in the lightweight class In 2009, she was awarded Arjuna award by the government of India for her achievements",,,An accomplished Indian boxer with multiple international medals and a strong sports legacy.,,https://en.wikipedia.org/wiki/Laishram_Sarita_Devi,,,,,,,,,,,,,,,,,
Tourism,Umiam Lake,Shillong,Meghalaya,"A large man-made reservoir in the hills 15 km (9.3 mi) north of Shillong, known for scenic beauty and water sports activities.","also known as Bara Pani, is a reservoir in the hills 15 km (9.3 mi) north of Shillong in the state of Meghalaya,",,,"A large man-made reservoir in the hills 15 km (9.3 mi) north of Shillong, known for scenic beauty and water sports activities.",,https://en.wikipedia.org/wiki/Umiam_Lake,,,,,,,,,,,,,,,,,
Tourism,Nohkalikai Falls,East Khasi Hills,Meghalaya,"The tallest plunge waterfall in India, cascading over 340 meters surrounded by lush forest.",one of the wettest places on Earth. Nohkalikai Falls are fed by the rainwater collected on the summit of a comparatively small plateau,,,"The tallest plunge waterfall in India, cascading over 340 meters surrounded by lush forest.",,https://en.wikipedia.org/wiki/Nohkalikai_Falls,,,,,,,,,,,,,,,,,
Tourism,Balpakram National Park,South Garo Hills,Meghalaya,"A biodiversity hotspot and sacred site known for rare wildlife, caves, and unique landscape.","located at an elevation of about 910 m (3,000 ft) close to the international border with Bangladesh",,,"A biodiversity hotspot and sacred site known for rare wildlife, caves, and unique landscape.",,https://en.wikipedia.org/wiki/Balpakram_National_Park,,,,,,,,,,,,,,,,,
Tourism,Elephant Falls,Shillong,Meghalaya,A two-tier waterfall,The mountain stream descends through two successive falls set in dells of fern-covered rocks,,,A two-tier waterfall,,https://en.wikipedia.org/wiki/Elephant_Falls,,,,,,,,,,,,,,,,,
Tourism,Nokrek National Park,West Garo Hills district,Meghalaya,A National park located approximately 2 km away fromÂ TuraÂ Peak,"the core area of the Nokrek Biosphere Reserve, is a National park located approximately 2 km away from Tura Peak in West Garo Hills district",,,A National park located approximately 2 km away fromÂ TuraÂ Peak,,https://en.wikipedia.org/wiki/Nokrek_National_Park,,,,,,,,,,,,,,,,,
Tourism,Kynrem Falls,East Khasi Hills district,Meghalaya,A three-tiered waterfall,It is situated inside the Thangkharang Park. It is the 7th highest waterfalls in India. ,,,A three-tiered waterfall,,https://en.wikipedia.org/wiki/Kynrem_Falls,,,,,,,,,,,,,,,,,
Tourism,Nohsngithiang Falls,East Khasi Hills district,Meghalaya,A seven-segmented waterfall located 1 kilometre (0.62 mi) south of Mawsmai village,"The water falls from a height of 315 metres (1,033 ft) and has an average width of 70 metres (230 ft).[1] making it one of the tallest waterfalls in India.",,,A seven-segmented waterfall located 1 kilometre (0.62 mi) south of Mawsmai village,,https://en.wikipedia.org/wiki/Nohsngithiang_Falls,,,,,,,,,,,,,,,,,
Tourism,Langshiang Falls,West Khasi Hills district,Meghalaya,"The Langshiang Falls is located near the village of Sangriang, 24 kilometres (15 mi) from Nongstoin","Considering the height to be correct, it is the 47th highest waterfall in India.",,,"The Langshiang Falls is located near the village of Sangriang, 24 kilometres (15 mi) from Nongstoin",,https://en.wikipedia.org/wiki/Langshiang_Falls,,,,,,,,,,,,,,,,,
Tourism,Tuirihiau falls,Serchhip district,Mizoram,The Tuirihiau Falls is located 5 kilometres (3.1 mi) south of Thenzawl,They are on the Vanva river near Buangpui and are sometimes mentioned together with the nearby Vantawng Falls,,,The Tuirihiau Falls is located 5 kilometres (3.1 mi) south of Thenzawl,,https://en.wikipedia.org/wiki/Tuirihiau_falls,,,,,,,,,,,,,,,,,
Tourism,Dampa Tiger Reserve,Lushai Hills,Mizoram,A tiger reserve covering an area of about 500 km2 (190 sq mi),"It covers an area of about 500 km2 (190 sq mi) in the Lushai Hills at an elevation of 800–1,100 m (2,600–3,600 ft). It was declared a tiger reserve in 1994 and is part of Project Tiger.",,,A tiger reserve covering an area of about 500 km2 (190 sq mi),,https://en.wikipedia.org/wiki/Dampa_Tiger_Reserve,,,,,,,,,,,,,,,,,
Tourism,Mizoram State Museum,Aizawl,Mizoram,An ethnographic museum with multipurpose collections on display. ,"There are five galleries: Textile Gallery, Ethnology, History, Anthropology, Natural History, and an Archaeology Terrace",,,"An ethnographic museum with multipurpose collections on display. There are five galleries: Textile Gallery, Ethnology, History, Anthropology, Natural History, and an Archaeology Terrace",,https://en.wikipedia.org/wiki/Mizoram_State_Museum,,,,,,,,,,,,,,,,,
Tourism,Palak Dil,Siaha district,Mizoram,The largest and biggest lake located near Phura village,"The lake is a major component of the Palak Wildlife Sanctuary,[2] and it supports the major biodiversity of the sanctuary",,,The largest and biggest lake located near Phura village,,https://en.wikipedia.org/wiki/Palak_Dil,,,,,,,,,,,,,,,,,
Tourism,Lengteng Wildlife Sanctuary,Saitual district,Mizoram,An alpine forest and contains the second highest peak. ,"It is specially a conservation interest on rare species of birds.It was declared a protected area in 1999,and a national wildlife sanctuary by the Indian Ministry of Environment and Forests on 31 May 2001",,,"An alpine forest and contains the second highest peak. It is specially a conservation interest on rare species of birds.It was declared a protected area in 1999,and a national wildlife sanctuary by the Indian Ministry of Environment and Forests on 31 May 2001",,https://en.wikipedia.org/wiki/Lengteng_Wildlife_Sanctuary,,,,,,,,,,,,,,,,,
Tourism,Hmuifang,Aizawl district,Mizoram,"A tourist spot about 50 km with an elevation of 1,619 metres,the mountain",is covered with forest reserves since all the Mizo Chief's time,,,"A tourist spot about 50 km with an elevation of 1,619 metres,the mountain is covered with forest reserves since all the Mizo Chief's time",,https://en.wikipedia.org/wiki/Hmuifang,,,,,,,,,,,,,,,,,
Tourism,Murlen National Park,Champhai district,Mizoram,A national park lies in north of Lengteng Wildlife Sanctuary. and covers an area of approximately 100 km2,"are home to a rich variety of flora and fauna. About 15 species of mammals, 150 species of birds, 35 species of Medicinal plants, 2 species of bamboos, and 4 species of orchids so far have been recorded in this Park",,,A national park lies in north of Lengteng Wildlife Sanctuary. and covers an area of approximately 100 km2,,https://en.wikipedia.org/wiki/Murlen_National_Park,,,,,,,,,,,,,,,,,
Tourism,Phawngpui National Park,Lawngtlai district,Mizoram,"One of the two national parks,often called the Blue Mountain which is the highest mountain peak, reaching 2,157 m asl ",The national park covers the entire mountain along with the surrounding reserve forest.,,,"One of the two national parks,often called the Blue Mountain which is the highest mountain peak, reaching 2,157 m asl ",,https://en.wikipedia.org/wiki/Phawngpui_National_Park,,,,,,,,,,,,,,,,,
Religion,"Solomon's Temple, Aizawl",Aizawl,Mizoram,The temple was constructed by the religious group Kohhran Thianghlim,translated as 'The Holy Church' in English.It was founded by Dr. L.B. Sailo in 1984 and is non-denominational,,,The temple was constructed by the religious group Kohhran Thianghlim translated as 'The Holy Church' in English.It was founded by Dr. L.B. Sailo in 1984 and is non-denominational,,"https://en.wikipedia.org/wiki/Solomon%27s_Temple,_Aizawl",,,,,,,,,,,,,,,,,
Cultural_Common_Sense,Champhai,Champhai district,Mizoram,The third largest town and is one of the oldest settlements ,founded by the Mizo people that initially served as a capital for the Hmar dynasty,,,The third largest town and is one of the oldest settlements founded by the Mizo people that initially served as a capital for the Hmar dynasty,,https://en.wikipedia.org/wiki/Champhai,,,,,,,,,,,,,,,,,
Tourism,Vantawng Falls,Serchhip district,Mizoram,The Vantawng Falls is located 5 kilometres (3.1 mi) south of Thenzawl,It is the highest uninterrupted waterfall in Mizoram. It is about 92 kilometres (57 miles) away from Aizawl,,,The Vantawng Falls is located 5 kilometres (3.1 mi) south of Thenzawl,,https://en.wikipedia.org/wiki/Vantawng_Falls,,,,,,,,,,,,,,,,,
